text,checked_label
"I think the idea of money as credit is very interesting (look at my HN comment history for my ramblings on the topic!).<p>&gt; I think the system described is interesting, but for regular human commerce purposes, I think the downsides of it (managing IOUs from many different parties, needing to have a trust-path between users that could steal from you, needing to keep a node online always or trust your money to someone else who does so) make it less useful than cryptocurrencies. Having a common currency between many different parties is much easier to work with than trying to figure out a workable way to value IOUs from many different parties. Needing an established trust-path between users seems like a large obstacle in the internet age where I might suddenly want to transact with anyone on the planet.<p>You are right, these are disadvantages but other than &quot;trust paths&quot; the complexity can be mitigated with:<p>1. Market makers who buy IOUs at a discount and swap them for _their_ IOU which can be more trusted. Essentially you want a little bit of centralisation around parties which are known to always make good on their liabilities. These parties could be fully automated (think like Ethereum DAO) and transparent. In some ways these market makers are like banks of today but instead of lending their credit into existence, like banks do, they require people to buy it (usually) at a premium.
2. Insurance or a credit derivatives market so people can hedge against counterparts defaults.
3. If everyone agrees on a common numeraire and wallets are sophisticated to show an aggregate balance in that numeraire taking into account credit risk then that could remove much of the complexity for users. Integrated with market makers, you could &quot;auto swap&quot; IOUs to issuers which you prefer. Wallets can also provide a credit risk break down on all counterparts. Agree this is more complicated than current notions of money.
4. Securitisation markets. Package up IOUs into tranches. Traders can speculate on various levels of credit quality.
5. Sensible reputation management. Non-invasive performance tracking of debtors. Did they meet margin requirements? Did they meet all coupon payments? Etc. Can also take into account degree of co-operation with other users, for example do they accommodate restructuring and help others meet their liabilities?<p>I don&#x27;t like crypto because there&#x27;s essentially zero accountability for issuers and that kind of environment is optimal for scammers. Crypto behaves like synthetic equity&#x2F;commodity instruments with no accountable issuers. In contrast, with a credit based system, issuers are responsible for their issued liabilities and are expected to make good on them. In crypto, no-one thinks in terms of liabilities and so you get ridiculous projects like &quot;Synthentix&quot; who are collateralising a USD Stablecoins with their own issued tokens. For anyone with a basic understanding of financial risk and accounting, their approach is mad.<p>A credit based system is fairer because anyone can issue credit and the onus in on issuers to ensure they have the necessary reputation for others to accept their credit. Furthermore, credit-like instruments are natural Stablecoins - providing all agree on a numeraire, the value of credit is a function of credit risk which can be successfully managed in most cases.",finance
"I have been waiting for weeks for Coinbase to help me with a simple issue (verifying my account so that I can move money received in my Coinbase wallet)<p>I tweeted at the official https:&#x2F;&#x2F;twitter.com&#x2F;coinbasesupport account (which is what Coinbase recommends) but did not get any reply. I also have not heard back over email.<p>This scam account however did reply, and you can see that they sent &gt; 400 tweets with the same M.O.:<p>https:&#x2F;&#x2F;twitter.com&#x2F;Coinbasewallet_&#x2F;with_replies<p>&quot;Hello. We would like to inform you that we cannot give specific account information over social media for security reasons.
Please, send us a private message and we will be more than happy to help you!D&quot;<p>---<p>Bad Coinbase customer support has created this opportunity...<p>On this note, does anyone know how to reach someone at Coinbase? I should probably just move my money elsewhere at this point. Any reccomendations? Thanks",finance
"It&#x27;s interesting that HN does not like Bitcoin, yet HN is one of the most technical places on the internet. 13 years ago I was working on MapleStory Emulators in C&#x2F;C++ at the age of 16 and was extremely overconfident in my abilities. Around the same time Bitcoin came out and I brushed it off since I was too cool for Bitcoin. I could reverse engineer the encryption on MapleStory and make the server from scratch, so Bitcoin as money sounded stupid. Why would I download this? This overconfidence&#x2F;dismissal probably stayed with more for 10 years<p>The reality was that Bitcoin was actually super cool just on a technical level, ignoring the economic utility. I should have spinned up a miner, played with it because of the technology. HN and my 16 year old self, was probably in the best position to play with technology that would probably have been the best financial decision of my entire life including this entire community.<p>To me, if anything, missing out on Bitcoin is a good example of how overconfidence, arrogance and dismal of new ideas in the technical space leads to missing out. What could we name this concept?<p>- Dismissal by Confidence<p>- Overconfidence Bias<p>- Arrogance because of Technical Ability<p>- Blindsided by Contrarian Rashness<p>The fact that Bitcoins market cap is 2.2T makes it one of the most successful open source projects in the history of humanity.<p>If anything, missing out on Bitcoin for me has nothing to do with Bitcoin, but a subtle reminder that being open, accepting and playful with ideas is important and who knows where that idea will take you.<p>What other ideas will HN dismiss and miss out on?",finance
"HitBTC has disabled withdrawing for Doge, XVG, XEM, and bunch of others. It&#x27;s looking like an exit scam and I feel sick to my stomach. My first cryptocurrency excitement went down with Cryptopia a few years back. Since then I&#x27;ve learned a ton and I&#x27;ve followed good security practices to keep my funds safe, but this really hit me out of the blue.<p>I transferred all my Doges (300k) to HitBTC to sell them, but I noticed that the price is way off. Then I found out that there has been withdrawal issues for a few weeks already, and that customer support was not willing to offer any help other than pointing to the system health monitoring page for updates. Reddit is full of these threads. My funds are stuck, I can&#x27;t withdraw them and I don&#x27;t want to sell them for half price. I know I&#x27;m not alone in this situation either, they have a ton of users. Never any problems for me before this, I don&#x27;t have any other funds there either.<p>I hope I&#x27;m not right about this situation but I feel disgusted, I don&#x27;t know how to go through this again. My heart rate is through the roof. I can&#x27;t sleep or eat. I&#x27;m on sick leave from work because I can&#x27;t keep myself together. My stomach feels hollow and nothing seems real. I had it made but lost it, what the hell am I supposed to do now?",finance
"What works is that we straight up give them housing, free needles, free-at-the-point-of-access healthcare, and treating addiction like we would treat a medical condition like diabetes-get them on a treatment plan without judgement.<p>The reason why there’s a ton of inefficient waste in Democrat cities is because of bullshit NIMBYism and constant resistance to just giving people minimum standards of living due to some notion of wanting to figure out who “deserves” it more.<p>We know what works. Needles exchanges work. Free healthcare works. Providing housing works. Strong social programs work.",finance
"Not sure how you think governments could demand changes from major cryptos. They&#x27;re not currently beholden to governments, and it seems unlikely they&#x27;ll become <i>more</i> beholden as they grow <i>larger</i>.<p>Volatility is ameliorated by stablecoins pegged to fiat currencies. Furthermore, the long-term goal is to not need an &quot;interface to the real world&quot;, because you will be paid in crypto and you will pay for things in crypto. <i>Even then</i>, who exactly do you mean when you say &quot;the people providing the interface&quot;? I don&#x27;t need a middle-man to agree to exchange crypto for fiat with someone. You can use one, sure, but it&#x27;s not required.",finance
"1. The Federal Reserve have to add reserves to the system when there is demand from the economy in order to keep the interest rate that they want. Otherwise, the interest rate would go up because the offer and demand dynamics between the private banks.<p>2. If there is not demand from the economy for credit, adding reserves to the system will push the interest rate very low (that&#x27;s happening now). If there is not demand from the economy those reserves will not be lend, ergo, they will not be inflationary (they could affect other financial assets prizes though).<p>3. Apart from keeping the interest rate where they want, adding reserves to the system will happen when the fed buy assets from the banks (they are payed with reserves). One of those assets are government bonds. So, the Central Banks can finance without limit (other than inflation) fiscal expansion from the treasury. This money, used to finance government spending, will be spend in the economy. So, it&#x27;s the fiscal policy what will be inflationary, not the number of reserves per se.",finance
"&gt; Dogecoin, a meme and joke, went from a quarter of a cent last year to 66 cents today.<p>Initially, from what I read about Dogecoin, I thought Dogecoin was an inflationary junk coin since it produces 5billion tokens per year. However, in considering the total supply, this is a less inflationary rate (not CPI--just creation) than the USD since this works out to around 4% anually.<p>I do still think Doge is a poor currency, but I don&#x27;t see it being much worse (I cringe writing this knowing I&#x27;ll be blown up) than fiat dollars other than major acceptance.<p>Either way I completely agree. Something is wrong.",finance
"The notion that people making $350K are having a particularly rough time is <i>nuts</i>.<p>As for inflation, it&#x27;s threatening to price people under your $150k&#x2F;yr cut-off for &quot;hardship&quot; out of decent housing even in mediocre cities, <i>ever</i>, and may eventually hurt creditors some (which, I mean, that&#x27;s a fine outcome according to most people, I&#x27;d think). Those with $150k+ salaries had damn well better have some assets to their name, including maybe a (mortgaged) house, and so will ride the inflationary wave alright. Those with little or nothing, on the other hand, may now never be able to afford anything. Young workers just starting out, who have high-ish income but only because they live in a place with insane housing prices, are getting screwed, too, sure, but established professionals will be fine, unless they&#x27;ve somehow managed not to acquire assets over the years.<p>Pity the normal couple with $60,000&#x2F;yr household income. Believe it or not, they raise kids on that income. Go figure.<p>I wouldn&#x27;t trade places with someone getting by on unemployment for their $12&#x2F;hr job they were laid off from, certainly. I don&#x27;t think they&#x27;re &quot;looting&quot;. We&#x27;re clearly top-heavy on capital, given how the markets are behaving, so I think I&#x27;ve got a better idea of where the looting&#x27;s happening.",finance
"No, governments are constrained by real resources. Deficits probably don’t matter as much as people thought they did, but that doesn’t mean deficit spendings can be unlimited. Plus not all spending is equal. Deficit funding of things like actual (physical) infrastructure doesn’t have the same issues as social programs. Like do we really think Western European countries have broad tax bases because they like it?<p>Using taxes as a means of controlling inflation (raising them when inflation rises) may be true in theory but it is of zero practical importance. Raising taxes during inflationary periods, compounding the loss spending power, is a fantastic way for a politician to lose their job.",finance
"This is such an inflammatorily bad take that I suspect it&#x27;s trolling at this point.<p>African Americans do not collect the majority of welfare in this country. Sops to multi billion dollar corporations like WalMart - why is that not welfare?<p>A trillion dollars of HNW tax evasion happens every year, simply because the IRS is underfunded and understaffed - why is that not the problem?<p>And isn&#x27;t asset price inflation a direct outcome of inequality? Lower money velocity leads to asset bubbles - this is something we know of since the French Revolution now.",finance
"&gt; the policies that he was promoting<p>Name a policy that helped his supporters. His policies either helped elites or hurt the other side, but did not help his base. Virtually the only thing he ever did for his own base was to give out COVID relief support.<p>Caging children at the border? All about hurting the other side that cares about immigrants.<p>Lowering corporate taxes? Help for elites, particularly for those with huge fortunes overseas. Workers saw virtually nothing from the tax cuts.<p>Stopping California from imposing stricter emissions standards? Help for elites.<p>Abortion? His side isn&#x27;t having them anyway, it&#x27;s all about hurting others.<p>Stopping student loan forgiveness? Either helping elites or hurting the other side. Maybe both.<p>Revoking the EPA&#x27;s jurisdiction over waterways so that there is more pollution? Helping elites and hurting his side. Republican states are far more polluted than Democrat ones.<p>The trade war that particularly hurt farmers?<p>We could keep going like this. Virtually all of Trump&#x27;s policies were designed to help elites, hurt the left, but not to help right.<p>The clearest way to put it, is the way his own supporters put it &quot;He is hurting the wrong people.&quot; That&#x27;s what Trump sells. It&#x27;s a world divorced from reality where anyone who doesn&#x27;t agree is an enemy.<p>Trump is not anti-elite. His supporters are not anti-elite. They love elites.",finance
"A central observation of modern monetary theory is that all (federal) govt spending is done that way but the fed: the fed just conjures 1 bajillion $ into Lockheed&#x27;s account, and taxes to &quot;pay for&quot; govt spending happen later. If that&#x27;s not directly true in details it&#x27;s true in effect.<p>The next logical steps are that (1) it can never default on debts in its own currency unless it chooses too and (2) we don&#x27;t need to &quot;pay for&quot; new spending with taxes. (Although taxes are still important for a variety of reasons: providing incentive structures, preventing inflation.)",finance
"&gt;Self-education is increasingly obtainable online<p>Which would be impossible if someone with a lot of money decide to hoard it instead of investing in YouTube.<p>You can&#x27;t guarantee that when people spend less money, they&#x27;ll favor cutting out &quot;bad&quot; things over &quot;good&quot; ones. If something is causing ecological externalities, you can tax always tax it. If something has positive externalities, but you didn&#x27;t raise enough money in taxes, you can fund it by printing more money.<p>&gt;Worse for who? Humans?<p>Half the world lives off less than $5.50 a day. They don&#x27;t have the luxury of caring about the environment. Madagascar nearly completely deforested, just from burning fuel for heating and cooking, so it&#x27;s not like the earth is guaranteed that less economic activity is going to be any better for the environment. Conveniently, poor people are also the ones who have most kids because they are the only source of retirement possible. The only ethical way to curb depopulation is to develop the economy in those poorer areas.",finance
"Why is it more lenient than other financing plans? That makes no sense. This could literally be a traditional lease with no cloud syncing bs involved, at a cheaper cost.<p>You’re accusing me of being manipulated but I have no horse in this race. You think this is a sexy idea for risk management in lending, I just find the idea abhorrent, that’s all. You’re falling into the modern polarization trap, we just don’t seem to share the same values re. privacy &amp; property rights.<p>Not looking forward to the day my car airbag stops functioning because a collection agency is after me, or I’ve been targeted by the government, or they just decide to refuse service because I said something awful on Twitter.",finance
"Let them condemn us, they will likely be absolutely right. Not condemning actions of now or of the past, because we don&#x27;t want to also be judged for our actions&#x2F;inaction is basically averting your eyes to try to escape your own responsibility.<p>You would probably fit in as &quot;feckless cog&quot; within consumerist capitalist machine, a machine that rarely really care about human rights. Relying on the individual consumer to police giant national&#x2F;multi-national corporations is an unfair and unrealistic burden. Conditioning consumers to believe that iPhones, cheap electronics and cheap clothing require exploitative practices is another shady tactic to maintain an inequitable&#x2F;unfair wealth&#x2F;class structure. The $1200 smartphone is built next to the $200 smartphone, the $50 shirt is sewn next to the $5 shirt, chip manufacturing is highly automated, and if cutthroat pricing wasn&#x27;t &quot;required&quot; and there was teeth behind anti-exploitative regulations, companies might care about auditing their supply chains.",finance
"I&#x27;m doing a startup that is in a very early stage and in a niche sector. I think that VCs in this niche could potentially be interested in meeting me, and I would also benefit a lot just by running what I&#x27;m doing by them - I have general VCs reach out to me all the time because they somehow gathered that I&#x27;m doing a startup, but no one in my niche. Is it worth reaching out to the niche VCs even if I&#x27;m not ready to raise funds? Or would they not want to meet me if that is the case?",finance
"Cryptocurrencies can still be subject to hard forks which allow seizure transactions. Likely in the future governments will demand such changes, if they don&#x27;t outlaw cryptocurrencies entirely. Furthermore, bitcoin&#x27;s value is highly volatile. So your initial investment of $100 might be worth $5000 or $0.10 in 3 years. You might not have to trust the network itself, but you have to trust the people providing the interface to the real world to not manipulate the price right when you do something.",finance
"The question you have could easy be answer by yourself if you just go to the official page and read for 5 minutes what they are doing and how.<p>Coil primary uses ILP its not a blockchain its a protocol it can use fiat or &quot;magic crypto cash on the interwebz&quot; its irrelevant.<p>&gt;This could also go via bank transfer, or hybrid systems like PayPal,stripe or vipps[1].<p>As soon as they support ILP yes, it could use whatever that&#x27;s the whole point.
An open standard&#x2F;protocol where everyone can join and offer competing service and 2 parties can transact with each other regardless of whos underlying service they use.<p>Like email. I dont care whos your email provider I just need your address and it works.
The IPL equivalent is called Interledger Payment Pointer. Again has nothing to do with blockchain.<p>If you actually are interested its now up to you to read more about it.
I wont go any further with this discussion.",finance
"100k isn&#x27;t what it used to be.<p>I often suspect we haven&#x27;t noticed the inflationary effects on this as a &quot;high&quot; salary as much as we otherwise would because of the psychological effect of the change from five to six figures. Yeah, the median salary is low, but that&#x27;s been well-covered elsewhere about how it hasn&#x27;t risen in line with costs or upper-percentile income - so think of this as just another example of &quot;here&#x27;s a field where you can&#x27;t make a comfortable income anymore.&quot;",finance
"&gt; If you donate $1000, your bank account contains $1000 fewer dollars, but you don&#x27;t get back $1000 in tax credits<p>That&#x27;s not how it works in France, you give 1000€ and you get an actual tax credit of 750€ (this is restricted to 20% of income tax).<p>So if you normally pay, say, 5000€ of tax, now in total you pay 4250€ of tax + 1000€ of donation ; but you can display on your website &quot;donated 1000€ to foundation X !&quot; (which has a value in itself as it improves opinion of your company, you can make a small press release, etc..) And that cost you only 250€ in practice.",finance
"We&#x27;re currently fundraising, and have received 50k from an investor (using a SAFE) in cryptocurrency, specifically USDC (a &quot;stablecoin&quot;).<p>We opened an account on Coinbase to receive the money and move it to our regular bank account, but we&#x27;re currently stuck, cannot move the money and customer support is not answering.<p>Can anyone help? Please answer here or email throwawcrypto@gmail.com<p>---<p>Longer story:<p>Coinbase is saying that I am verified on its dashboard, I have an email from them saying I&#x27;m verified, but when I go to purchase the ETH necessary to actually move our money it prompts me to verify again.<p>When I go through the verification process again it puts me in an infinite loop of reverifying over and over. I had to reach out to support 3 times before they even escalated it. I was told it was escalated but it&#x27;s now been a week without hearing anything despite 2 follow ups on my end.<p>Until I am verified I can&#x27;t purchase the ETH to send to our wallet to move our USDC to Coinbase to sell it to get USD to deposit to our bank account.",finance
"I am a VP at a global startup (operations), high tech applied to low-tech industry.<p>We have 1 very charismatic person in charge of sales who ofter persuades the CEO (and founder) to make stupid decisions.<p>The latest is to amend a multi-million dollar contract with a supplier by means os &quot;a phone conversation&quot; between said Director or Sales and the Director of Sale of the supplier; unbeknown to the CFO&#x2F;CEO? and legal department of this supplier.<p>My pleads to amend the existing contract in writing, as called for by the original contract have been ignored and I am now effectively been cut off from the discussion.<p>So, what is the proper:<p>* response<p>* reaction<p>* behavior<p>going forward?",finance
"Musk will be lucky to live till he&#x27;s Bezos age given all the heavy drugs he does (it&#x27;s the world worst kept secret really)<p>Also Musk will not make much money from SpaceX because like everything he&#x27;s involved in the margins are terrible (molecules and atoms don&#x27;t make money).<p>His net worth has balooned because of his ability to sell an ever improving vision of the future and constantly moving the goalposts, but solving climate change is becoming a crowded trade socially speaking.
Politicians and central bankers are coming to the show and they run circles around him with regards to social competence and speaking abilities, so he&#x27;d not even get the glory .<p>Kamala Harris will be remembered in the history books as the 1st female POTUS , the politician who also solved climate change and landed humanity on Mars, while Musk would be left with a very low margin business and no social recognition, and no narrative to propel the stock.",finance
"Maybe some on here have the combination of econ&#x2F;finance understanding and hacker ethos to answer this well.<p>If we are staring down the barrel at inflation, what can one do to protect their personal assets?<p>I took out a favorable car loan, but can’t easily buy a house where I live. Too much of my money is in the bank, though I’ve been buying slowly into the stock market.<p>Is there some creative personal finance or lifestyle hack to follow here? I’m not looking to get rich or speculate, just take the best choices available.",finance
