text,checked_label
"I know what you mean, but there are ways to estimate the brand value. Eg: In 2020, Coca-Cola&#x27;s brand was valued at 84 billion U.S. dollars. While I couldn&#x27;t find any reliable values for Tesla, the same methodology should apply here as well. It just comes to show to what extent the market has a blind spot for what certainly is a huge asset.",finance
"Maybe with Darkside, but they account for a very small amount of activity. Back in the Gandcrab days, anyone with a credit card could fire up their own tenancy, and they mostly sucked at it. They would lose the decryption keys or send non functional decryptors. They were not interested in talking and just thought the RaaS platform would be a passive income for them.<p>I mostly dont do ransomware housecalls anymore, but my teammates tell me the situation has mostly not improved.",finance
"In the USSR, when it still existed, retail prices were stamped on the items at the manufacturing plant, because of how stable the prices (and the economy in general) were. After the collapse, this practice had stopped entirely for obvious reasons.<p>So the fact that such a thing as &quot;manufacturer&#x27;s retail prices&quot; still exist, in the USA of all places, and that they apparently has some legal weight was a surprise to me. TIL.",finance
"I don&#x27;t know that much about current crypto technology, but enough to know the majority of comments in this discussion have not been keeping up to date with block chain innovations, the surge away from proof of work to proof of stake, the massive increases in transactions per second through innovations in both Level 1 and Level 2 block chain tech. Moreover, there are real applications: Look to Vechain for supply chain authentication, and Theta, a project by a founder of YouTube, that is live now and enables efficient delivery of 4k+ hidef video streaming.",finance
"These already exist, e.g. foldingcoin. One problem is that they require a centralized authority to approve and distribute workloads, and so this entity has undesirable power over the network. I do believe there are some cryptocurrencies where you can submit arbitrary workloads and you pay for it with the currency of the network. But they never took off, probably because they don&#x27;t match the efficiency and&#x2F;or data privacy of AWS.",finance
"Yeah, I was pushing that all under &quot;recovery.&quot; Say it all sums to $C.<p>Arguably the bigger problem is you don&#x27;t know that the ransomer will actually give you a valid key, but suppose you guess a likelihood P that they do.<p>Now you have some scenarios:<p>1. Don&#x27;t pay. We&#x27;re out $C.<p>2. Do pay, and get a valid key. We&#x27;re out $R.<p>3. Do pay, and get no key. We&#x27;re out $R + $C.<p>So the limit is at scenario 1 being equal to the combination of 2 and 3.<p>Set C = PR + (1-P)(R + C), and your max ransom R = CP<p>(You could probably work in additional costs for cleaning up even if the ransom is paid.)",finance
"I was thinking replacing hacker with scammer. After all, Scammers scamming old folks are just showing a gap in online education and regulations.<p>Ransomware gangs aren&#x27;t the vigilante heroes&#x2F;embodiment of the undervalued IT security worker. They&#x27;re a group of people looking to make a quick buck and don&#x27;t give a damn about the harm they cause or who they cause it to.",finance
"Given pas doubts about tether management, the more important number is what % of the tether issued is backed at all, now how it is backed. The transparency report [1] shows that they have 0.2% more assets that liabilities (in USD) which gives me more confidence than anything else.<p>[1] <a href=""https:&#x2F;&#x2F;wallet.tether.to&#x2F;transparency"" rel=""nofollow"">https:&#x2F;&#x2F;wallet.tether.to&#x2F;transparency</a>",finance
"Yes, up to a limit.<p>It&#x27;s super trivial to withdraw, say, 1M. You can use <a href=""https:&#x2F;&#x2F;tornado.cash&#x2F;"" rel=""nofollow"">https:&#x2F;&#x2F;tornado.cash&#x2F;</a> to mix 100 ETH, there&#x27;s currently around 10k such deposits, so you could do that 2-3 times to move 1M in ETH to an address that can&#x27;t be tied to your previous addresses.<p>It&#x27;s possible but no longer trivial to withdraw 10M. You could use the above method over a period of time, and some other methods.<p>It becomes much more difficult at much higher values. You could probably get 100M out disguised as trading profits or something. If I spent a few days thinking about it I could probably figure out ways to mix that much money on ETH, filter through DeFi apps, etc. Seems doable.<p>You could also just work with large exchanges that don&#x27;t care. I don&#x27;t know which ones are like that now, probably fewer than years ago.",finance
"Until one of those people buys a Tesla with bitcoin (yeah, I know they just stopped doing that) from a wallet that can be traced to that payment, and then its just the authorities following up the chain.<p>People like to seem like all these crypto&#x27;s are totally anonymous, but every transaction ends up in some sort of public blockchain. So unless you have air-tight OPSEC and people that will never talk, no matter what kind of jail time they are facing, its always going to be traceable with enough interest.",finance
"There is investment infrastructure. Mostly informal and enforced via smart contract and multisignature transactions. Organized on forums and chat rooms.<p>Not much capital is needed though and the affiliate and licensing model is better, which also just means an address is hardcoded that splits payment, or a server controls the private key (or master private key for infinite unique address creation) to addresses and automatically splits received payments to the RaaS service<p>I get that was supposed to be a joke, its not very funny and is exactly the same or even more streamlined than the licit economy. There is no major distinction except the kinds of “risk factors” one might list.",finance
"&gt; Amtrak hasn&#x27;t had the vision to stick with the plan.<p>I think this would be better stated as “funding” — it&#x27;s not like nobody at Amtrak has failed to think about the hotspots for them, it&#x27;s just that they are in the unfortunate position of being expected to service a lot of [now] marginal routes against both very well funded alternatives, but they have limited governmental support for the kind of major infrastructure changes they need to dramatically improve their offerings.<p>A completely private business could, for example, simply discontinue unprofitable lines or acquire long-term debt to fund a major capital investment but they were created specifically to avoid closing routes and debt is a political hot potato. A government service could point to greater societal benefits to justify funding out of general tax revenue but Amtrak is expected make enough in ticket revenue that they&#x27;re perennially short of cash. A large part of the problem is simply that railroads have high base costs which can be made up in volume but their service costs more than alternatives because we don&#x27;t subsidize rail anywhere near as much as highways (for example, DC to NY on train costs more than a bus, but I-95 isn&#x27;t a toll road funded only by users).",finance
"Clearbanc and others super useful to help short term cash flow, but its tough to get enough money out to take money off table (a lot of founders have a chance to take money off to go buy a house etc...).  For example one of our portfolio company was started by 4 guys with $20K, and we just were able to pay them $4M, and then if they keep growing it they get more upside.  One of the ways to grow is to increase the inventory and then increase the velocity of sales through new channels and increase in advertising. They didn&#x27;t grow it in the past because they didn&#x27;t want to make that investment but we have access to capital to make that investment.",finance
"There’s a huge network of financial controls to prevent and detect this sort of thing, it’s one of the foundations of the fields of accounting. Often there are departments looking for fraud regularly.<p>I suspect small or medium organizations rather then megacorps would be easier targets if they haven’t invested money in accounting controls.",finance
"Well, I guess you can consider a manufacturer to be either an actual manufacturing company that sells directly to wholesalers or retailers OR a company that owns a brand which purchases product in bulk to sell to wholesalers or retailers.<p>Either way, a lot of companies want their products to be seen in a certain &quot;class&quot; of products, and it&#x27;s harder to maintain that brand image from a pricing standpoint if everyone can just sell it at whatever they want.<p>So, what happened at this large discount cigar place is that, like I said, they were doing something similar to Wal-Mart&#x27;s strategy: sell a ton of product at a low profit margin and force manufacturers to come down in prices as a result.  The manufacturers hated it because (a) their existence relied on the good will of this corporate behemoth, and (b) supplying so much product to the discounter meant less was available around the country for retail shops, which is essential to building brand loyalty.  When Leegin happened, the discounter begrudgingly admitted that they would be forced to raise prices. But not before buying out a few accessory manufacturers.<p>While not as popular as simply discounting cigars, it sorta worked for them. They would sell a box of cigars at the lowest price that they could and then include a free humidor to store them in. And what collector of stuff doesn&#x27;t want another container for their stuff?<p>I&#x27;ll say too, that some manufacturers simply refused to do business with the volume discounter until after Leegin.  They had built up a market for themselves with independent shops without needing to go to the volume discounter... but after they could be ensured that their prices would be stable, they opened the floodgates.",finance
"Tesla is only a car company the way Google is an email or search provider, imo.<p>Their long bet on cryptocurrencies is smart given instead of shedding electrical load into the ground, Tesla can probably recoup the electricity to power micro mining. There is so much fashionable hating on Musk, and that he manages to survive it means those people don&#x27;t see what he does.",finance
You dont do it that way. Just drop it in Tornado.cash and a few days later withdraw to a virgin crypto address. The virgin crypto address just pumps a token that you bought in another address with clean money prior.<p>You sell the token in the clean address at a massive profit and cash out under your real name and ID <i>and even pay taxes</i>.<p>Go look at any highly pumped token on Uniswap&#x2F;Sushiswap&#x2F;Pancakeswap and you’ll find plenty of addresses that either bought or added to the liquidity pool using funds that begin with Tornado.cash,finance
"The process of balancing production capacity with sales demand is referred to as capacity planning and it is used across the FMCG industry, from food supply chains to many more.<p>It is an essential aspect of manufacturing. Besides production, the grocery supply chain management can be applied to almost any FMCG endeavor with difficulty meeting demand.<p>The logistics management software solutions also extend to service sectors, retail and commercial sales, information technology, government agencies, and so on.<p>Software in this industry is most often used to arrange production to meet short- and medium-term needs, but it&#x27;s also an integral part of long-term strategic and organizational planning.<p>Formal preparations and run-throughs of the entire supply chains occur once per year in most organizations. This isn&#x27;t ideal and an iterative model of the operation, which takes into account market demands, production capabilities, and order fulfillment, can be fulfilled better with the help of production capacity planning software.<p>What Is warehouse inventory management software? How does it work?<p>Capacity planning is the process of deciding a production line, operation department&#x27;s, or function capacity to satisfy a specific demand over time across FMCG and the food supply chain. This includes using grocery supply chain software in the steps that must be taken to change the system&#x27;s ability to satisfy demand.<p>This can then be used to evaluate a capacity plan that not only satisfies demand but also meets certain requirements such as lowest overall cost, highest throughput, and on-time delivery.<p>Source:- https:&#x2F;&#x2F;throughput.world&#x2F;blog&#x2F;how-ai-powered-capacity-planning-is-improving-manufacturing-landscape&#x2F;",finance
"<i>&gt; The people trying to sell products have every incentive to lie and mislead potential consumers.</i><p>Absolutely not, unless your business model relies on single sales.<p>In functioning organizations with <i>actual products</i>, marketing and sales are advocacy functions for the customer as much as they are revenue functions for the business. They&#x27;re how you know what to make and who to target.",finance
"All of this complication is the problem. Jeff ends up getting benefits that most people don&#x27;t get, at least not most younger people.<p>15% and&#x2F;or 20% plus 3.8% is still less than the 22% to 32% range that a lot of people will fall into. And that 22-32% is on 100% of taxable income, there is no break on part of it.",finance
There are ways to crack encryption that have nothing to do with math.  It doesn&#x27;t matter how good your crypto is.  You could probably get by plain text as far as the FBI&#x27;s effort to crack your crypto are concerned as they won&#x27;t waste their time checking if you are that stupid.,finance
"Co founder needed! https:&#x2F;&#x2F;getwido.com<p>I have a great idea that needs to be built, asap. If I don&#x27;t do it, someone else will. I have been working on it for a couple of weeks and need someone technical to join me in building the MVP and raising first money. I have validated it with a few potential customers and found strong interest.<p>So what&#x27;s the problem Wido is trying to solve?<p>It will help anyone discover crypto and make passive income on it. It will allow people to learn from other crypto investors to earn the same. It also allows users to share their investment activities with others, thus creating a social or collaborative investment platform. Wido is also a platform for developers who build those investment products.<p>It&#x27;s like Venmo on crypto steroids.<p>If you are not interested in crypto, this is probably not for you.<p>I am looking for a strong technical cofounder with passion for crypto. Someone who wants to join something big for the long run. This is a multi year project with a potential to change how people think about and use their money.<p>Something about myself: I am technical too. I studied computer science and spent few years working as an engineer. Then I moved into product where I spent another few years. I have experience from big companies (Microsoft) as well as startups (Appear Here in London, named the AirBnB for retail by The Guardian). You can learn more about me here: https:&#x2F;&#x2F;www.linkedin.com&#x2F;in&#x2F;mazurroman&#x2F;<p>We are in a rush here! It&#x27;s not about what or why, its about WHEN. We need to build it ASAP.<p>If you are interested, please get in touch: roman@getwido.com Include: why do you want to join and what&#x27;s the best way to contact you. We will then chat and I am happy to share much more about Wido including early prototype.<p>Please upvote if you are not interested to let others see it.",finance
"Over the past few weeks privacy coins such as Monero, Zcash and Aargh values have increased at a much fastet rate than BTC.<p>What effect do You think the anti ransom taskforce will have on crpto values and will there be a differing impact for public vs. private coins?",finance
"Hey HN,<p>We&#x27;re thinking about starting a fintech company in the space, and we&#x27;re wondering what the fees are like for users buying stocks etc through an application. Essentially, does Robinhood pay a 30% fee each and every time a user buys a stock?<p>We&#x27;ve searched through Apple&#x27;s website and guidelines - https:&#x2F;&#x2F;developer.apple.com&#x2F;app-store&#x2F;review&#x2F;guidelines&#x2F;, but we&#x27;re unable to find any clear answers. Could you folks please help?",finance
"Meh, YDFM is a little bit more of a farmers market, but neither it nor BuHiFM are farmers markets they&#x27;re both grocery stores and YDFM doesn&#x27;t have anywhere near the international selections.<p>The real, actual farmers market is the Atlanta State Farmers market in Forest Park and it&#x27;s one of the largest and most active in the US.",finance
"I know you&#x27;re saying this in jest, but that&#x27;s the calculus.<p>The outcome here shows that executives made the right call.  The $5MM fee was easily paid, less than the costs of security, and the insurance company will probably cover it anyway.  And the government&#x2F;people were so outraged that the attackers were met with fucking swift justice.<p>The company will probably get some grants or something to cover the cost of &quot;securing their infrastructure.&quot;  Never let a good crisis go to waste.",finance
"People like to complain about testing and what they really measure, but what alternative is there?  Even a &quot;real world&quot; problem is still a test, just a really hard, open-ended one.  The tests that we subject students to represent somebody&#x27;s honest attempt, at least, to create questions that an intelligent person at their age can come up with an answer to without access to any external material.",general
"In Cambodia, people buy dirt to increase their property’s elevation so that their neighbor’s house floods when the monsoon comes. Then the neighbor has to pay for more dirt and so on throughout the whole neighborhood.<p>It seems like the attackers are finding the paths of least resistance. Beefing up security at each organization isn’t fixing the underlying problem. It’s just making the next entity the more likely target.<p>I don’t even know what the underlying problem is though...",general
"If you have already have a track dedicated to the ground-effect airplane, seems to me that it&#x27;d always be more cost effective to build a railroad on that track and move more people. The track is the hard part.<p>Ground-effect vehicles might make sense over water, though, building effectively a very fast ferry. There&#x27;s a startup from the last YC Batch trying it.
Regent: <a href=""https:&#x2F;&#x2F;www.regentcraft.com&#x2F;"" rel=""nofollow"">https:&#x2F;&#x2F;www.regentcraft.com&#x2F;</a>",general
"Thanks! Still sounds really good :).<p>Is there a usb-c gpu that would be compatible? (edit: we&#x27;ll see: <a href=""https:&#x2F;&#x2F;news.ycombinator.com&#x2F;item?id=27144085"" rel=""nofollow"">https:&#x2F;&#x2F;news.ycombinator.com&#x2F;item?id=27144085</a> )<p>I already replaced my battery 2 times, speakers once, wifi once. All was just so still possible on my 2016 laptop. I have an even older laptop with broken screen in use too.<p>If only I didn&#x27;t want to run a game every now and than :). I now wonder what to get next:<p>- another laptop with a dedicated gpu<p>- something like this here and some usb-c gpu as soon as the onboard gpu doesn&#x27;t do the trick anymore<p>- or a desktop for games and media stuff (and a pinebook for typing and youtube or just use my machine from work)",general
"A practical step that would not be excessively costly would be to standardize the three types of rail in the US - local tram, commuter, and intercity&#x2F;high speed (fun fact - depending on your definition of high speed rail current Amtrak trains can hit that, as on correct track and with positive train control they can do 125+ MPH).<p>If it&#x27;s standardized it will be easier to make sure you can develop it piecemeal.",general
"I think everyone hates to admit they were wrong about a topic they care about. There have been a lot of studies about confirmation bias.<p>I like to play devil&#x27;s advocate. I think it&#x27;s also important to acknowledge that your opinions are <i>not</i> you. Separating them from your identity allows them to change more easily.<p><a href=""https:&#x2F;&#x2F;moveyourcompanyforward.com&#x2F;2020&#x2F;11&#x2F;03&#x2F;four-ways-to-overcome-confirmation-bias&#x2F;"" rel=""nofollow"">https:&#x2F;&#x2F;moveyourcompanyforward.com&#x2F;2020&#x2F;11&#x2F;03&#x2F;four-ways-to-o...</a>",general
"&gt; The government can help coordination by making defecting more costly (with criminal penalties).<p>not just sticks, but also carrots: The federal government should commit to doing all it can to help organizations that refuse to pay ransoms. This would include help from 3-letter agencies as well as bringing in alternative IT infrastructure. Obviously the federal government doesn&#x27;t have all of these capabilities now, but this should be a priority going forward.",general
What I find humorous about it is Pokemon puts these code cards that give you a booster in the online game. They have a greyish one and a green one. If you get a green one you got a foil 100% in the pack so what I don&#x27;t get is why don&#x27;t they just make the grey one thicker to compensate for the weight difference?,general
"Hi HN. I&#x27;m writing you because I&#x27;m a bit miffed about my first electric toothbrush that my dentist prescribed me. It&#x27;s called a Philips Sonicare DiamondClean and it cost me $180. When you&#x27;re at the dentist, it&#x27;s customary to pay at the time of services rendered....I already regret this. The problem is that this toothbrush requires the Philips Sonicare Android&#x2F;Apple app. I gave it a whirl, but during the setup process I&#x27;ve noticed so many dark patterns. For starters, it requires that Bluetooth and Location be on all the time. Secondly, the app does _not_ allow screenshots to be made of it! It just disables that on Android for me. Third, the manufacturer does not state any of this on the package, and probably has no necessity to do so.",general
"Yes, it went to full trial in the senate. Where he was ultimately not found guilty. The legal process played out.<p>But not before the prosecuting team was found to have been doctoring evidence against him. By adding a blue checkmark to tweet, they were then using to try and convict him. ITs what happens when people try to use the ends justifies the means thinking.",general
"I got a poison ivy rash, from weeding. It got annoying, so I bought a white boletus mushroom, shaved the stem into a mix of hand sanitizer, dish detergent, and hydrogen peroxide 3%, and mashed it up well; rubbed it thoroughly into the rash, rinsed, put more on and let it dry. The swelling started to go down in only minutes. Three hours later, it doesn&#x27;t itch at all.<p>I gather that in Japan they make lacquer out of poison ivy sap, polymerizing it with enzyme from shelf fungus.",general
I remember seeing articles about her from the perspective of FL covering up numbers and targeting her. There was a lot of discussion about it.<p>I wonder which perspective is &quot;true&quot;.<p>https:&#x2F;&#x2F;www.yahoo.com&#x2F;news&#x2F;rebekah-jones-covid-whistleblower-wasn-103039488.html,general
"I mean, the pipeline in question provides half of the gas to the US East coast. You don’t have to love oil to see that losing 40% of the supply to more than 100m people overnight would be a public safety (what if emergency vehicles can’t buy fuel?) and economic risk.<p>The number of people reliant on this pipeline is several orders of magnitude greater than would be impacted by taking a single hospital offline. You’d need to have many hospitals impacted to create a similar level of risk. The only big difference is that taking out hospital infrastructure can kill people immediately whereas the impact of a pipeline failure won’t generally be felt for days or weeks.<p>Edit: Based on your other response it sounds like we are on the same page.",general
"&gt; Unfortunately your technology will likely fail, because:<p>To Whom It May Concern: If human beings took advice like yours, we&#x27;d be living in caves. And no doubt the first person who proposed living in a cave heard the same. You are free to say what you like, of course, but try to stay out of the way of the people working. :)<p>How is something like this found on <i>Hacker News</i>, hosted by <i>Y Combinator</i> in <i>Silicon Valley</i>?",general
"Or more to the point, it&#x27;s Robert Lustig flacking his &quot;sugar is toxic and addictive&quot; theory. So the headline is almost more informative than the article. It&#x27;s all heavily driven by Lustig&#x27;s &quot;sugar is as bad as heroin&quot; thing, which seems to me the same kind of counterproductive as a lot of anti-drug messaging.<p>We <i>should</i> all eat less heavily-concentrated foods that make it easy to eat too much, and are both very tasty and readily available. You shouldn&#x27;t need to exaggerate the dangers -- and it&#x27;s definitely disturbing that people still don&#x27;t follow what&#x27;s really very simple advice.<p>In a sense that makes it all very timely. Right now we&#x27;re watching a similar conflict play out where people are fighting against doing the right thing, often citing mixed messaging on the details while completely missing very simple and obvious things. We see the difficulty in reaching out to both people who demand &quot;the absolute, fully complex truth&quot; before believing any of it AND people who are prone to falling for obfuscations no matter how simple you make the advice.",general
