text,checked_label
"If you&#x27;re like me, you&#x27;ve wasted hours searching online for startup ideas. You&#x27;ve read dozens of &#x27;Top 30 startup ideas for 2021&#x27; articles which all say vaguely that &#x27;crypto&#x27; and &#x27;fintech&#x27; are ideas you should pursue. Maybe you&#x27;ve perused r&#x2F;Startup_Ideas but were overwhelmed by random people&#x27;s musings about dog social networks. You&#x27;ve likely read pg&#x27;s essays on the topic, but trying to be open-minded while observing the world around you so far hasn&#x27;t led you to any amazing breakthroughs. And maybe you&#x27;ve bought some domain names and half-built an idea or two, only to realize it wasn&#x27;t a good enough idea to be worth spending more time on.<p>I believe there are many ways to get good startup ideas. Building something for your own use and then realizing its broader commercial opportunity worked well for Slack, Plaid and I&#x27;m sure many others. But I haven&#x27;t had that luck yet (call it what you will).<p>Another way I&#x27;ve seen work -- at least for building relatively successful companies, if not industry-shattering unicorns -- is to start by solving 1 specific problem for 1 person willing to pay for it. I believe corporate America has thousands of problems that new tech startups could solve well, but there&#x27;s a big information gap. Today, you don&#x27;t just have to have the skills to solve a problem -- which many of us do -- you also have to be lucky enough to be in a position to know the problem even exists.<p>I&#x27;ve just created a subreddit, r&#x2F;ProductsIdPayFor, in an attempt to address this. I have no idea if that will work. But I wanted to do something to try.<p>If others have suggestions for a better solution, or if you have thoughts or feedback generally, I am all ears. Thanks for your interest and good luck with your startup endeavors.",job/career
"Garner Health | New York City | Full-time | Onsite | Product Designer | Product Manager | Product Engineer 2 | Data Product Manager<p>Garner Health is a doctor recommendation product for employees that helps them find the best doctors through data and then covers their out-of-pocket expenses. By getting people to visit better doctors, we can meaningfully improve health in the US and also lower the cost of healthcare. We launched in December with over 10,000 lives covered and recently closed a new round of funding, bringing our total up to $17M from Founders Fund, Sequoia, Thrive, and other top firms.<p>Find more details here: <a href=""https:&#x2F;&#x2F;boards.greenhouse.io&#x2F;garnerhealth"" rel=""nofollow"">https:&#x2F;&#x2F;boards.greenhouse.io&#x2F;garnerhealth</a><p>Email at john@getgarner.com to introduce yourself and tell us why you would be a good fit for the job. Send us a resume (as a PDF, please). More importantly, though, have something else to say! Let us know what you’re interested in, what makes the job interesting, and anything else you want to tell us up front.",job/career
"Lately I saw some comments of people that claim they don&#x27;t work 8 hours a day anymore, mostly because of their sanity, and they complete the same amount of work or even more. One of them spent 4 hours on coding and 2 hours for meetings and learning, which seems totally not feasible for me. I have a lot of activities and even one more hour a day (7 hours of daily work) would be a real blessing. I could use it for learning more programming stuff, but not necessarily related to my job.<p>The questions are:
How long is your typical flow state?
How long are your breaks and how you use them?
How do you remove distractions?
Is there anything more I should know?<p>Thank you in advance",job/career
"I suppose this is a bit desperate - but it SO hard to find skilled AND
passionate CPU&#x2F;GPU RTL designers or individuals with a solid grasp on the
Linux graphics stack.<p>I&#x27;m the founder of Chip11 - and we&#x27;re on a mission to build an ecosystem
of open source hardware components.<p>Our progress so far:<p>- we&#x27;re funded<p>- functional&#x2F;verified LPDDR4&#x2F;5 PHY<p>- functional&#x2F;verified SERDES PHY<p>- GPU RTL running some basic 3d application<p>- CPU RTL running some basic C code<p>We need to finish out the LPDDR4&#x2F;5 controller
as well as the CPU design and GPU design.<p>Finally - we need to write some drivers.<p>We plan to release our entire codebase under GPLV3
after we tapeout a fully functional SOC.<p>Been on HN for a while and am aware it has a stronger bias
towards software - but hoping to bump into people with hardware
strengths as well.<p>Well rounded individuals are the best. Cannot understate how
nice it is to find somebody who can fluently write hardware 
and then switch to writing Rust at a flick of the wrist.",job/career
"Straightaway | Principal Product Designer | US Remote<p>We&#x27;re using technology to create a whole new logistics category that will allow 1 hour delivery of anything, anywhere. We&#x27;re now backed by Mapbox and I&#x27;m building the team that can help us realize our vision.<p>This is an insane opportunity to shape the product and contribute to the vision of Straightaway as we disrupt the hottest market around: last-mile logistics.<p><a href=""https:&#x2F;&#x2F;boards.greenhouse.io&#x2F;mapbox&#x2F;jobs&#x2F;2607461?gh_jid=2607461"" rel=""nofollow"">https:&#x2F;&#x2F;boards.greenhouse.io&#x2F;mapbox&#x2F;jobs&#x2F;2607461?gh_jid=2607...</a><p>Apply above or email me zach@getstraightaway.com",job/career
"Either here or on reddit I&#x27;ve seen plenty of people mention the option of working as a contractor as a viable option.<p>I have been working as a developer for 12 years. For the first six years of my career I wrote C++ &#x2F; Python for a finance-adjacent firm.<p>The second half of my career has been the typical full-stack developer stuff. Django &#x2F; Pyramid &#x2F; SQLAlchemy backend and several different front-end frameworks like Vue and React.<p>It&#x27;s enough to say that I&#x27;m a generalist and a decent enough programmer.<p>I&#x27;d love the ability to work a contract for 6 months to a year and then take a few months off between gigs. But when I search for contract opportunities they seem somewhat rare. Additionally, the contract gigs I find seem to be seeking people who would prefer full-time employment but would settle for the contract as a sort of &#x27;probationary&#x27; measure. I never seem to find opportunities where it is seen by all parties as a temporary placement.<p>Am I looking in the wrong place? Are there certain employment agencies that I am not aware of that have these in abundance? Am I lacking in experience? If so, what do I need to do?<p>I live in NYC. I would think that would be helpful but I&#x27;m not sure.",job/career
"open source maintainer salary !== FAANG total comp package<p>E5 engineers at FB are making an avg 200k base [1]. That is not that far off what you would expect the difference to be between open source maintainer and senior engineer at Facebook.<p>That is not 3-4x. Even if you include stock, that will put the FB eng around 350k. You may have an argument for the 2-3x range but basically only at the very top level companies and senior roles, not mid level contributors.<p>IMO HN likes to exaggerate compensation levels.<p>[1] <a href=""https:&#x2F;&#x2F;www.levels.fyi&#x2F;company&#x2F;Facebook&#x2F;salaries&#x2F;Software-Engineer&#x2F;E5&#x2F;"" rel=""nofollow"">https:&#x2F;&#x2F;www.levels.fyi&#x2F;company&#x2F;Facebook&#x2F;salaries&#x2F;Software-En...</a>",job/career
"Pairing is optional at my employer.<p>As a manager, I&#x27;m always on the look-out for tasks where I feel pairing may provide value.  These are often moderately complicated tasks where I want a more junior team-member involved. Or, doing green-field UI work, I&#x27;ll suggest one of the more UX-savvy developers pair with a small group of developers.<p>I have also managed people who just like to work together and they&#x27;re free to pair and unpair on an ad-hoc basis.  I don&#x27;t care, as long as progress is being made.<p>Edit - I&#x27;ve never &quot;paired&quot; in the way you suggest in a sibling response (assigning a ticket to 2 developers).",job/career
"I honestly don’t know either.<p>I don’t know how it is in the UK. Here in the US, a hiring manager sees a gap in the resume and asks about that. This has been a problem for say, women who exited the workforce to take care of their kids and then attempt to reenter it. I suppose, even if there is no negative mark, if you have a stack of 30 or 40 resumes, you start using “relevant recent experience” as a way to filter down to the people you want to interview.<p>There is also a tendency for agism, worse in some industries or disciplines than in others — maybe some kind of cult of youth thing going on. (I have found that development teams favor younger developers, even for senior developers, while ops and devops tend to favor a slightly older crowd).<p>There is a great article explaining how a software developer can get better negotiating position that can potentially bypass that resume gap: <a href=""https:&#x2F;&#x2F;www.kalzumeus.com&#x2F;2012&#x2F;01&#x2F;23&#x2F;salary-negotiation&#x2F;"" rel=""nofollow"">https:&#x2F;&#x2F;www.kalzumeus.com&#x2F;2012&#x2F;01&#x2F;23&#x2F;salary-negotiation&#x2F;</a><p>... but only because you can do this with software development, not necessarily with anything else.",job/career
"TLDR: Dear former founders, what jobs did you take after leaving your startups, and what advice can you give a former CTO?<p>I recently had to close down my bootstrapped startup. Small, tech niche product, always made enough to pay a team but nowhere close enough for me to retire now. I had to fire my entire team, great people, and made an effort to see all of them get into new jobs.<p>Once everyone was squared away, I took a break to recover mentally and physically. Now my funds are running low, and I have to take a job. Multiple aspects make me unsure where to go from here:<p>- I am still relatively young (not even 30), and would be considered a junior SWE in most bigger orgs, but I don&#x27;t want to lose managing teams.
- I coded less and less, managed more and more, so I would have to go for team lead roles, but I am young and have not much prior experience.
- I really loved, for the lack of better words, having so much impact and freedom. Can joining anywhere as employee give me the same, especially in bigger orgs?<p>Those of you having had similar experiences, where did you go next, and what advice can you give me? Should I try for a bigger org and fill up my bank account, but not have impact because I will have a hard time even getting a team lead role? Or should I try to join another startup, but not make much money (again)?",job/career
"&gt; The median senior engineer pay in Italy is around EUR 38k - up to EUR 78k if you have around a decade of experience<p>I see these salaries in places like Spain, Italy, and even Germany outside of Frankfurt &#x2F; Berlin, and I&#x27;m flabbergasted. I&#x27;ve lived in the EU and travelled quite a bit, too. If anything, the prices for food, electronics, sundries, etc. are MORE expensive than the US because of VAT.<p>Housing, I&#x27;m sure, varies just like in the US, but I wouldn&#x27;t imagine it&#x27;s all that different. A small 2BR &quot;condo&quot; (i.e. not a single house with yard) in a mid-tier city in the US can now easily be $300K and probably similar in Italy, Spain, or Germany, at least in urban areas where all the jobs are located.<p>How do you guys live?",job/career
"The company has what I consider a valuable asset and therefore I find that the determination of the value of the company cannot be solely based on turnover&#x2F;profits.<p>The company exists for 15 years, is run by two persons and the yearly sales of URL filtering solutions is less than USD 250,000.
The assets are a URL database with 53 categories and content categorisation bots with two AI engines.
The URL database has &quot;only&quot; 16.9 million entries but covers 99.77% of all URLs used by a large Telecom in the USA.
The coverage percentage varies; it depends on country and client type and is for some clients 99.90% or even 99.99%.<p>We consider to sell the company and start a new business in agriculture.
The &quot;burning&quot; question is how to determine the value of the URL database and the categorisation bots, and ultimately determine a reasonable&#x2F;just asking price for the company.<p>Thank you for suggestions.",web/mobile
"Hello HN,<p>I&#x27;m currently in the second semester of my Bachelor in Computer Science in Germany, but I learned to program pretty early in high school.<p>I want to decide what I want to specialize in and I hope you can give me some recommendations or new ideas.<p>I enjoy building optimized software in my free time, working closely with the hardware. For example I worked on an application doing calculations and rendering on the GPU in Rust (I learned almost everything for that on my own. I really like Rust now).<p>This is also why I dislike web development (impossible to build well optimized web applications). Maybe embedded programming is something for me?<p>I&#x27;ve also always been fascinated by game development (I made a few small games myself), sadly it&#x27;s not paid that well, but thinking about a concept, building a game around it (with help from a friend for art) and letting people play it is an amazing feeling. I hope to have enough free time next to my job to keep doing that.<p>I am also interested in computer graphics in general, for example algorithms like raytracing, raymarching, so I wonder what your thoughts are on working on a game engine or a renderer for movies.<p>My grades of the first semester were okay (2-3) in math (I am doing a math minor) and good (1) in computer science modules. I really like to learn and come up with algorithms and to prove theorems (I liked analysis and linear algebra). What are your thoughts on going into research?<p>Maybe AI, machine learning or computer vision are something for me, but from my research it looks like most of the job consists of collecting and cleaning up data and feeding it into an existing learning engine, not actually implementing or improving the engine. Also it sounds to me like &quot;AI&quot; is over-hyped.<p>So I think that sums up most of what I can tell you about me.
What computer science fields did I not see? What jobs would you recommend me to look into?<p>Thank you for your time.",web/mobile
"We&#x27;re a UK based company that sells subscription software, and we have customers worldwide. We can&#x27;t be the only UK company dealing with VAT MOSS post-Brexit, and yet I&#x27;ve struggled to find much discussion about this online. Post-Brexit, the accounting software we use no longer provides the VAT MOSS report, and all of our EU sales were included in our UK VAT return. A huge mess. When I asked our accounting software about it, they provided a sort-of solution that would involve us setting up a new separate account with them just for  the EU sales. I&#x27;ve checked a few other accounting softwares, and they all seem to offer the same kind of solution. Surely there must be a better way?? What are other UK businesses doing? We can&#x27;t be the only ones dealing with this...",web/mobile
"I wrote the terminal canvas renderers in VS Code that has been called out a few times here. Initially I implemented a canvas renderer using just a 2d context to draw many textures which sped things up &quot;5 to 45 times&quot;[1] over the older DOM renderer.<p>Since then I moved onto a WebGL renderer[2] which was mostly a personal project, it&#x27;s basically the first canvas renderer but better in every way since it works by organizing a typed array (very fast) and sending it to the GPU in one go, as opposed to piece meal and having the browser do its best to optimize&#x2F;reduce calls. This was measured to improve performance by up to 900% in some cases over the canvas renderer, but actually much more than that if for example the browser has GPU rendering disabled and tried to user the canvas renderer on the CPU.<p>My opinion here is that canvas is a great technology, capable of speeding things up significantly and getting close to native app performance. It comes with very real trade offs though:<p>- Cost of implementation and maintenance is much higher with canvas. This is particularly the case with WebGL, there have been very few contributions to xterm.js (the terminal frontend component) in the WebGL renderer because of the knowledge required.
- Accessibility needs to be implemented from scratch using a parallel DOM structure that only gets exposed to the screen reader. Supporting screen readers will probably also negate the benefits of using canvas to begin with since you need to maintain the DOM structure anyway (the Accessibility Object Model DOM API should help here).
- Plugins&#x2F;extensibility for webapps are still very possible but requires extra thinking and explicit APIs. For xterm.js we&#x27;re hoping to allow decorating cells in the terminal by giving embedders DOM elements that are managed&#x2F;positioned by the library[3].<p>More recently I built an extension for VS Code called Luna Paint[4] which is an image editor built on WebGL, taking the lessons I learned from working on the terminal canvas renderer to make a surprisingly capable image editor embedded in a VS Code webview.<p>[1]: <a href=""https:&#x2F;&#x2F;code.visualstudio.com&#x2F;blogs&#x2F;2017&#x2F;10&#x2F;03&#x2F;terminal-renderer"" rel=""nofollow"">https:&#x2F;&#x2F;code.visualstudio.com&#x2F;blogs&#x2F;2017&#x2F;10&#x2F;03&#x2F;terminal-rend...</a><p>[2]: <a href=""https:&#x2F;&#x2F;code.visualstudio.com&#x2F;updates&#x2F;v1_55#_webgl-renderer-is-the-new-default"" rel=""nofollow"">https:&#x2F;&#x2F;code.visualstudio.com&#x2F;updates&#x2F;v1_55#_webgl-renderer-...</a><p>[3]: <a href=""https:&#x2F;&#x2F;github.com&#x2F;xtermjs&#x2F;xterm.js&#x2F;issues&#x2F;1852"" rel=""nofollow"">https:&#x2F;&#x2F;github.com&#x2F;xtermjs&#x2F;xterm.js&#x2F;issues&#x2F;1852</a><p>[4]: <a href=""https:&#x2F;&#x2F;marketplace.visualstudio.com&#x2F;items?itemName=Tyriar.luna-paint"" rel=""nofollow"">https:&#x2F;&#x2F;marketplace.visualstudio.com&#x2F;items?itemName=Tyriar.l...</a>",web/mobile
"Hey HN,<p>A friend and I are working on a SaaS productivity tool. Not our first venture, but we realized that building email+password login is a huge PITA because of password management&#x2F; password recovery &#x2F; signup confirmation emails &#x2F; weird ‘email not verified’ states &#x2F; spammy signups &#x2F; spammy logins &#x2F; forgotten email &#x2F; change email or password and many other cases we need to handle.<p>So we are thinking - why not offer only social login (at least for our MVP)?? It certainly seems much more preferable as we can focus on our core business, but it’s also so hard to find successful companies that went this route? How important is native email&#x2F;password login anyway?<p>Are there any examples of companies that were successful with only social login (Login with Google &#x2F; Github etc)? Will I alienate our users by going this route?",web/mobile
"https:&#x2F;&#x2F;shiraeeshi.github.io&#x2F;editable-list&#x2F;article.html<p>Here is a question: which options do we have for designing (an architecture of) an application which shows a list of strings in console gui, allows to edit strings in an edit field that appears next to a list, and shows logs, and which design would you choose?<p>Let&#x27;s play a game: there are some variations of console list application architecture listed in this article. If you come up with some new architecture, which is not listed in here, then I owe you an imaginary glass of beer. And if it is listed in the article, then you owe me one.<p>You have at your disposal functions that draw strings, rectangles and grids on the screen in console: https:&#x2F;&#x2F;gist.github.com&#x2F;shiraeeshi&#x2F;70e447fbbb5ae9a6ba1bf1c0c9bdd2cf
Also the function to register key button press events is given: https:&#x2F;&#x2F;gist.github.com&#x2F;shiraeeshi&#x2F;6aa2055d840297b1d55fac2e11b72e12<p>You can copy-paste the above code into your project.
Also you would need to add this dependency to the project:
- ansi-terminal &gt;= 0.10.3<p>Don&#x27;t worry about adjusting the width of a list to the length of strings, you can use fixed width. Also don&#x27;t worry about the height of a list or the height of the logs container, let&#x27;s show 5 items in a list and you can use fixed height.<p>You can use a library or you can reinvent what the library does, it&#x27;s up to you.<p>The idea of the game is that you put this article aside and start writing your version of console strings list, and after you finished that, come back to the article.<p>Good luck!",web/mobile
&gt; Java is disliked on HN because it represent &quot;enterprise&quot; - big long-lived organizations which maintain a codebase for decades<p>It&#x27;s one of the few languages out there capable of producing a codebase that lasts for so long.  That annoying verbosity and enforcement of naming conventions and directory structure mean that the Next Guy (or Gal) to come into the project and probably figure out what&#x27;s going on.  Most codebases written in other languages are constantly rewritten in the language <i>de jure</i>.,web/mobile
"I built a Telegram bot that allowed users to run a configurable script on my server.<p>Here is how it works:<p>1. User contacts the bot
2. Configures how he wants to run the script.
3. User asks the bot to start it.<p>What happens when the user starts it is that I create a new thread running the script. The script involves listening from updates from another API so I thought running it as a thread would be a good choice.<p>Now what happens is that some users tell me that the script stops working after a while. Perhaps the thread gets killed by the OS after a while?<p>I am trying to understand what is a good architecture for such an application.<p>Right now, there are 10 people who use the bot so it handles it effectively. What if I run it on EC2 instances with load balancing enabled?<p>Another way I was thinking of making it work is like this:
1. Running the bot on a separate EC 2 instance
2. Running a web server on another instance with load balancing.
3. Now when a user asks the bot to run it, the bot calls the web server and runs a new process&#x2F;thread there.<p>I wonder what would be the implications when load balancing comes into the picture.<p>Another question: thread vs new process. Different processes did not work properly the last time I tested so I want to know whether it is my mistake or running a different process IS a wrong way of doing it.",web/mobile
"After being a XAML&#x2F;WPF C# developer for quite some time, I&#x27;d like to modernize my skill set and learn some web app development.<p>Ive seen React, Angular, Vue and all these well established GUI Frameworks over the years. Whenever I&#x27;ve tried learning React, I found the process very complex compared to WPF. I always get the feeling, if I&#x27;m using a layout engine, why don&#x27;t I just use the basic constructs of that platform. This being plain JS, CSS, and Html.<p>Is it wrong or unproductive to start off my learning experience with the fundamentals? It sounds like an obvious yes, but I look around and see people going straight into React.<p>I don&#x27;t want to go into something like React without knowing basic concepts. Also is there a good book on learning the fundamentals?",web/mobile
"What do you think, can it be that some type of bad programmer would write a quality code?<p>They will never try to reinvent the wheel, they will google up the best practices, write in small understandable chunks, thoroughly follow naming conventions in order to not confuse themselves in the  future, document everything in comments etc.<p>Their bad part is mostly the speed. Lacking experience, they have to consult with stackoverflow, refactor every now and then and eventually burn out.<p>While the good and fast coder will deliver the working code in hours and days to the manager&#x27;s satisfaction, though not as universal and forward looking (in terms of configuration and integration hooks).<p>And the coder that I classify as mediocre knows and employs all the programming patterns which makes their quickly written code standard and understandable, but not always working as expected until several testing iterations pass.<p>So what do you think, does this classification make sense, who would you hire and what does the first category need to do?",web/mobile
"Hi HN, I have recently passed Turing&#x27;s PHP and Laravel MCQ test. Wanted to test out the platform out of curiosity.  They are inviting me to a live coding challenge next which I think is centered around DS and Algo challenge. I&#x27;m not very comfortable with DS&amp;Algo questions (it&#x27;s been a while since school that I haven&#x27;t practiced them). I&#x27;m planning to spend some time reviewing the interview material but I&#x27;m a bit worried whether the effort will be wasted. Is it a legit site? I&#x27;m from Nepal and opportunity to work in a U.S. based company would be great to aim for.<p>Any suggestions?<p>Thank you for reading my post.",web/mobile
