text,checked_label
"&gt; I don&#x27;t think so, as you can embed allmost any math concept in a real world context.<p>Not without adding a lot of complexity. What I meant is that the concepts taught in maths very rarely map directly to any real world problems. GPU programming is a good example, it uses a lot of vector related maths but the leap from not knowing about vectors to GPU programming is huge and not a good way to learn the subject, since you would have to think both about the complexity of GPU&#x27;s and graphics and about the vector abstraction at the same time. The reason you had fun doing GPU programming is because you already knew about the interface of vectors so you had no problems working with them.",AI/Data Science
"As a small company using one of the providers (<a href=""https:&#x2F;&#x2F;usefathom.com&#x2F;"" rel=""nofollow"">https:&#x2F;&#x2F;usefathom.com&#x2F;</a>) it offers us choice. We don&#x27;t want to build and run our own analytics and we don&#x27;t need the vast features of a Google Analytics or similar either. Even without the privacy benefit the set metrics we get now acceptable. We don&#x27;t have, e.g. a growth manager who needs to report these, investors who question the or make decisions when one metric looks off. Legitimacy didn&#x27;t come up once during our migration and we didn&#x27;t look too closely to compare to our previous provider (Google Analytics). It&#x27;s not the core of your questions but there&#x27;s usecases where less metrics, less accuracy is good enough.<p>Personally I have a background in metrics and reporting tools. I&#x27;ve been tasked to find and explain 0.3% differences between two reports or have cookie related (or timezone related) code getting reviewed by other engineers at previous companies. With millions of dollar at stake, Powerpoint meetings or investor or financial documention it makes sense to question every definition and the whole data pipeline.<p>&gt; Coolness over effectiveness? What&#x27;s all the fuss really about?<p>Ok, I admit, there&#x27;s a bit of coolness factor. Paying $25&#x2F;month to a small bootstrapped company (with a great podcast) beats feeding data to an ever growing global player (Google).",AI/Data Science
"It&#x27;s because people confuse Google&#x27;s tracking of people to serve them better ads in order to get more money from advertisers and their product, Google Analytics, aimed at <i>advertisers</i> to see statistics about people visiting their sites, and the effectiveness of the Google Ad Network.<p>Google Analytics, without the ad-related features enabled ( they aren&#x27;t by default), is anonymous and only collects and stores generic data like http request, times, location, language, browser, OS, etc. Neither Google nor the Analytics user &quot;track&quot; or &quot;spy&quot; on the website user.<p>With the extra ad features enabled, it&#x27;s more complicated because it allows creating user groups and retargering via DoubleClick cookies, so it&#x27;s a lot less acceptable from a privacy standpoint, since Google identify the site user ( with a pseudonymous identifier) for retargeting with ads later on another site. The advertiser still knows very little about the site user, and Google are just the intermediary.<p>Google Analytics without the ad stuff is just a good, easy to use site analytics solution. It&#x27;s easily blocked, but so are all the others in a similar vein. It bothers me a bit that I can&#x27;t just block the ad part without the rest, because people who run websites need to know what happens with them (access.log is very cumbersome to parse, and lacks a lot of very useful information like screen size, time spent on page to know if it&#x27;s just a misclick or a legitimate visit, etc.)<p><a href=""https:&#x2F;&#x2F;developers.google.com&#x2F;analytics&#x2F;resources&#x2F;concepts&#x2F;gaConceptsTrackingOverview"" rel=""nofollow"">https:&#x2F;&#x2F;developers.google.com&#x2F;analytics&#x2F;resources&#x2F;concepts&#x2F;g...</a>",AI/Data Science
"You don&#x27;t seem to understand what I mean.<p>If the system is designed to be cut in the event that it would be unaligned with its on-ground receptors, through opto-mechanical interrupters, then you <i>cannot</i> use it for an aggression, unless you move the on-ground receptors all the way to your target, but that would be very flagrant and difficult to hide, and every worker at the receptor facility would see it, as well as any civilian far or near the project.<p>The only way that such satellite could go wrong is if it actually does not integrate such failsafe mechanisms, and if its real design is <i>hidden</i>, and ill-known to anybody except a handful of military-secret-bound engineers.",AI/Data Science
"Some of my family and I have been enjoying playing with the BirdNET[0] app which seems to use the ideas presented here to identify birds from recordings, utilizing machine learning.<p>[0] <a href=""https:&#x2F;&#x2F;play.google.com&#x2F;store&#x2F;apps&#x2F;details?id=de.tu_chemnitz.mi.kahst.birdnet"" rel=""nofollow"">https:&#x2F;&#x2F;play.google.com&#x2F;store&#x2F;apps&#x2F;details?id=de.tu_chemnitz...</a>, <a href=""https:&#x2F;&#x2F;apps.apple.com&#x2F;us&#x2F;app&#x2F;birdnet&#x2F;id1541842885"" rel=""nofollow"">https:&#x2F;&#x2F;apps.apple.com&#x2F;us&#x2F;app&#x2F;birdnet&#x2F;id1541842885</a>",AI/Data Science
"it is so strange how things evolve in parallel in various fields. We used to love object oriented modeling with inheritance hierarchies, until the point we realized how it was so hard to have any hierarchy perfectly match a given domain.<p>Then we moved to composability + interface, realizing it&#x27;s easier to compose attributes (often related to a given set of functions) to make any graph of structures instead of just a tree.<p>Just two days ago looking at how virus recombined themselves in the most random ways, i wondered if the species classification of the previous centuries based on trees were not destined to follow the same path.",AI/Data Science
"I&#x27;ve created an ad campaign that is intended to direct viewers to a blog I started about a technology consultancy I am considering starting in the Cincinnati area.<p>https:&#x2F;&#x2F;loticsystems.blogspot.com<p>My mistake may have been to start writing about some goals I have with the company.  Namely standing up for progressive movements such as LGBTQ and BLM.<p>The ad was running fine, with a click rate of a little less than 1%.  Then the other day I saw a banner across the top of the Google Ads campaign page that said the campaign was being blocked due to a &quot;Subverting Systems policy&quot;.<p>I clicked the &quot;Contact Us&quot; link, which required me to provide contact details (including address).  After I provided that information I received an email that stated that they&#x27;re currently overwhelmed and that due to the COVID pandemic there&#x27;s no guarantee they&#x27;ll be able to respond in a timely manner.<p>I&#x27;ve been involved in technology for about 20 years professionally, so I can absolutely guarantee there is nothing fishy going on from the technical side of the equation.  Unless I&#x27;m not allowed to direct an ad to my blog, but who needs personally identifiable information to rectify something like that?  In the meantime it dawned on me that I really don&#x27;t know the &quot;checks and balances&quot; that Google has in place to ensure customer privacy and&#x2F;or safety.  I don&#x27;t know how &quot;freely available&quot; information within their systems is to the Google Ads team, and since they definitely appear they&#x27;re going to be taking their time to actually address the issue my fear really at this point is that one day they&#x27;ll just drop the case once my contact info has been distributed to whoever is trying to obtain it.<p>CONTINUED IN COMMENTS...",AI/Data Science
"A quick example, then a general explanation.<p>In a recent interview, I came into contact with the analysis of genetics and have found myself fascinated by the data and systems involved. After a single bio 101 class in college, I had a tiny interest, but this turns it into something like a fascination.<p>I&#x27;ve often hear people talk about so-and-so, or this-and-that being the reason they got into subject x.<p>What is your story? Particularly the questions below.<p>- How and what topic(s) did this happen for you?<p>- Are the resources you can share that might help others similarly?",AI/Data Science
"Hi, so I recently build cortazar.ml using a text recommendation engine that works with the native TensorflowJS word embeddings, reduce them to 2D and then perform a geoquery with MongoDB.<p>As I reflect about the algorithm, I find it has plenty of applications and would like to share them with you. The full story includes 5 startup ideas where the technology could be applied:<p>https:&#x2F;&#x2F;medium.com&#x2F;geekculture&#x2F;how-to-develop-a-text-recommendation-engine-99d3b46effdb?sk=508c65e2139bfdfbd8043b2090ee1bd7",AI/Data Science
"I think the main complaints about VAR in football have been the amount of time these decisions take and the inconsistency of the rulings. Instead of the constant play we used to have, now we see players stand around as the screen shows lines drawn in seemingly arbitrary locations to decide whether or not an attacking player was onside before a goal.<p>In contrast, fans have been fine with the goal-line technology, which gives decisive (usually) and quick results.<p>The use of AI in this paper seems more relevant for setting team strategies and picking players rather than enforcing rulings.",AI/Data Science
"&gt; The author doesn&#x27;t owe it to us.<p>There are like 6 different definitions of what a &quot;transformer&quot; is and none of them fall under &quot;machine learning&quot;. If you have a README, then that implies its <i>intended for others to read</i>, and so it should be made with that in mind. If I happened to be interested in machine learning, this would be a project that I would bookmark for further use -- except I wouldn&#x27;t <i>know</i> to bookmark it because they didn&#x27;t bother to include a total of two words (&quot;machine learning&quot;) that give context of how to parse the word &quot;transformer&quot;.<p>The fact that the owner didn&#x27;t provide that context is not excused by the fact that the repository owner decided to implement a handful of research papers. It absolutely is the responsibility of the authors of projects, and the authors of README files, to provide context about what something does. The entire point of the README is to clear up ambiguity about what something is. You might as well say, why not include a README? People who are using the project know well enough how to run it!",AI/Data Science
"When ADAS systems come into play, the primary concern is who&#x27;s going to shoulder the blame when things fail. This autonomous driving thing is no simple nor incremental improvement, this is an overhaul in our current structure of liability. So far, with a human driving, when things go awry, blame can be easily assigned, it&#x27;s simple and case can be closed. When we introduce total absolution of the former party in charge, simeone else has to step in. The only one with any control here is the producer of the vehicle, yet the scope of responsibility is far too large for anyone at the traditional levels of rigor. The consequence is that ever increasing levels of safety requirements get demanded from the self-driving technology, enough to make it at any time both insuficiently mature and a ever more desired thing for how much it has to offer in order to cover the said requirements. Mr. Musk seem like a smart man to not be aware of this, which makes me think about the moral hazard of his tweets.",AI/Data Science
"The number of privacy-focused analytics tools is ever-growing. And the perfect balance between freshness and promoted evilness of legacy tools is appealing.
Rightfully, all of them try to mitigate identity to promote privacy. And while it makes sense, at first sight, questions arise around the usefulness of the resulting statistics.<p>What is a visitor in a privacy-focused analytics tool? Can we have a returning visitor when it is not tied to identity over time and across visits? How can we even interpret these numbers?<p>Let&#x27;s summarize the ladder of identity on the web:
Logged in user &gt; Persistent identity (e.g. cookie) &gt; Ephemeral identity (e.g. 24h hash) &gt; no identity.<p>Privacy-focused tools seem to provide the last ones while promoting the same advantage as the first ones! Coolness over effectiveness?<p>What&#x27;s all the fuss really about?<p>It&#x27;s worth noting that the question is not about all the different kinds of statistics these tools can provide without relying on a cookie but about the legitimacy and the relevance of the visitors&#x27; related statistics (e.g., new, returning, etc.).",AI/Data Science
"The query &quot;to our surprise&quot; currently shows around 219 000 results. The query &quot;not surprising&quot; has about 1 620 000 results. That&#x27;s about 7 times as many.<p>I have no idea if this is surprising or not.<p>Somewhat more surprising is that the query &quot;italian mad scientist&quot; has 4 results in Google Scholar. Those are all due to the SCIGen fake scientific paper generator, which sometimes outputs this phrase: <a href=""https:&#x2F;&#x2F;pdos.csail.mit.edu&#x2F;archive&#x2F;scigen&#x2F;"" rel=""nofollow"">https:&#x2F;&#x2F;pdos.csail.mit.edu&#x2F;archive&#x2F;scigen&#x2F;</a>",AI/Data Science
"The problem with <i>any</i> vision based system is that it isn&#x27;t what humans use. In winter in cold climates sometimes the roads are covered with snow for days to weeks and road margins drift for the entire season. Humans just form new emergent lanes. These lanes often aren&#x27;t the &quot;correct&quot; lanes that non-vision based absolute position would find. And they&#x27;re very difficult to detect with computer, or even human, vision.<p>Autonomous cars might be possible for climates without snow but they&#x27;ll never be capable of driving with humans in winter till they start making the same intuitive mistakes as humans given sparse data (complete snow covering).<p>Having one set of laws of autonomous cars in arizona and another for minnesota will lead to a lot of problems.",AI/Data Science
"Autonomous cars might be possible for climates without snow but they&#x27;ll never be capable of driving with humans in winter till they start making the same intuitive mistakes as humans given sparse data (complete snow covering).<p>The problem with <i>any</i> non-vision based location system to compensate for covered roads is that it isn&#x27;t what humans use. In winter in cold climates sometimes the roads are covered with snow for days to weeks and road margins drift for the entire season. Humans just form new emergent lanes. These lanes often aren&#x27;t the &quot;correct&quot; lanes that non-vision based absolute position would find. And they&#x27;re very difficult to detect with computer, or even human, vision.<p>Having one set of laws of autonomous cars in arizona and another for minnesota will lead to a lot of problems.",AI/Data Science
"I was hesitant to share because it&#x27;s quite new and still in development but I&#x27;m glad someone from outside actually tried it! It has some issues as you have pointed out and I really appreciate the detailed report, I&#x27;ve noted them.<p>There are no currently no explanation of the ML parameters since I still use the website mostly for manual testing. Sadly, some of them are crucial for model accuracy and they are not easy to manually configure for the user, so the plan is to integrate meta-learning that finds the best possible parameters on its own. I will take a look into the model now :)",AI/Data Science
"When I went to uni in Sweden, there was a mandatory course in <i>academic writing</i> as part of CS program. The learning objectives was more than just a styleguide proofreading by supervisors though, as methodologies, data collection and paper structures was covered. Pretty much the scientific process really.<p>This seemed to be quite needed for students to get up to speed. I was from Finland, where this subject was brought up  before uni.<p>For what it&#x27;s worth, I remember my supervisor calling bullshit on my then dense and overly academic writing and I thank them for it. It was a process of un-learning bad patterns or preconcieved notions about the writing process.<p>Recommend.",AI/Data Science
"Thank you for your insights.<p>The metric is pretty simple, the number of unique visitors. And the setup is simple, too, with no identity whatsoever. But are they compatible? This is the question.<p>Your approach is interesting. You take a stance: let&#x27;s have precise metrics when users consent and don&#x27;t consider those who didn&#x27;t give their consent. This approach relies on the underlying assumption that those who do not give their consent represent a minority and thus don&#x27;t have a perceivable impact on the overall statistics. And this very assumption may be false.",AI/Data Science
"One of the biases in Hacker News is that comments like yours tend to get downvoted.<p>Some of my more reserved comments get downvoted, and then flooded with replies about 360 vision and cars never getting sleepy.<p>IMO: Most of the autonomous driving tech will evolve to be driver assistance and safety tech in the upcoming decade. I still believe we&#x27;ll get autonomous driving <i>someday,</i> but not until we have a few more AI breakthroughs.<p>Until then, &quot;Autonomous driving&quot; will be like &quot;Duke Nukem Forever.&quot;",AI/Data Science
"While I’m sure Apple collects ample (pseudo anonymous) data from their respective stores about patterns, they actually don’t gather that much data about you.<p>For a long time they’ve had an “on device” policy to handling data. Buy a new phone and your frequently visited locations list is empty. Most of their AI stuff only lives on your device.<p>Of course there are limits to what can be handled on your device, but they’re generally pretty open about what happens where.<p>Make no mistake, the privacy stance is a profit maker for Apple, and that’s the real reason they’re doing it.<p>In any case, I’m way more likely to trust Apple with my data than Google or Microsoft. Google and (to some extent) Microsoft has based their business around collecting and&#x2F;or selling my data, Apple makes a living by selling me hardware and software, and privacy is the one parameter that Apple can compete on that will directly reduce profits of its competitors.<p><a href=""https:&#x2F;&#x2F;www.apple.com&#x2F;privacy&#x2F;docs&#x2F;A_Day_in_the_Life_of_Your_Data.pdf"" rel=""nofollow"">https:&#x2F;&#x2F;www.apple.com&#x2F;privacy&#x2F;docs&#x2F;A_Day_in_the_Life_of_Your...</a>",AI/Data Science
"I did look this up and found slightly different numbers:<p><a href=""https:&#x2F;&#x2F;www.moneyadviceservice.org.uk&#x2F;en&#x2F;articles&#x2F;how-much-does-a-funeral-cost"" rel=""nofollow"">https:&#x2F;&#x2F;www.moneyadviceservice.org.uk&#x2F;en&#x2F;articles&#x2F;how-much-d...</a><p><a href=""https:&#x2F;&#x2F;nfda.org&#x2F;news&#x2F;statistics"" rel=""nofollow"">https:&#x2F;&#x2F;nfda.org&#x2F;news&#x2F;statistics</a><p>But I would maintain that the invasive practice of embalming is unnecessary and unusual elsewhere in the world.",AI/Data Science
"&gt; Why have telemetry at all?  Essentially, it’s to help us to identify product issues early:<p>&gt; Audacity is widely used across several platforms, but we have no information on the application stability.<p>Really?  You have <i>no</i> information about this?  Don&#x27;t you think instability would be reported by <i>some</i> users?<p>&gt; It is difficult for us to estimate the size of the user base accurately.<p>You can obtain an <i>estimate</i> by tracking the number of downloads along with some far less intrusive metrics like user agent, etc.<p>&gt; We need a way to make informed decisions about which OS versions to support. For example, can we raise the minimum version of the macOS to 10.10 to update the wxWidgets to the latest version?<p>Generally speaking no you should not raise the minimum OS version on a ubiquitous piece of software like this.  Either work with the library vendor to find a way to support old and new, or use a different library.<p>At a minimum keep the old versions around, there are no doubt offline installations out there running on old kit.  Don&#x27;t <i>force</i> everyone to upgrade their hardware&#x2F;OS.<p>&gt; We have a known issue with the new file format introduced in Audacity 3.0. We found it with the great help of the community members on our forum. However, there is no way for us to estimate the impact of these issues on users. Is it just a random case? Do we need to rush the work on the recovery tool or help the users one by one? Or do we need to rethink the file format to make it safer and more easily recoverable?<p>Again, use the estimate metrics from downloads and user agents.  And in any event you should prioritize fixes by the severity of the issue, not by &quot;how many people does it affect&quot;.  Just focus on writing stable software.",AI/Data Science
"Not really correct. Advertising incrementality is pretty easy to determine by in-market tests or statistical modeling. Feature Engineering for effective model construction does require a body of significant domain knowledge and so your average academic Post-Doc or FAANG data science type tends to struggle in this space unless they learn quickly (I&#x27;ve hired from both before). The space is dominated by large research vendors, specialist consultancies or in-house teams with accumulated institutional knowledge. All this costs though and pays out only if your marketing budgets are in the tens to hundreds of millions of dollars zone.",AI/Data Science
"This reminds me of the first bubble.  Everyone on the inside were looking at each other as stock and salaries skyrocketed thinking this was crazy and unsustainable.  But we all just shrugged because there was no stopping the hype train.<p>Here, anyone even just tangentially involved or know the some details of AI&#x2F;ML are highly skeptical that Elon&#x27;s vision of self driving cars will occur in our lifetime.  Yet, Elon keeps pitching it, the press runs with it, and the public grabs it up, patiently waiting.",AI/Data Science
"&gt;Utilizing data from a study of 421 homeless adults moving into PSH, this paper presents descriptive technology findings, and compares results to age-matched general population data. The vast majority (94%) currently owned a cell phone. &#x2F;...&#x2F; Most (85%) used a cell phone daily, 76% used text messaging, and 51% accessed the Internet on their cell phone. One-third reported no past 3-month Internet use.<p><a href=""https:&#x2F;&#x2F;www.researchgate.net&#x2F;publication&#x2F;315541163_No_Digital_Divide_Technology_Use_among_Homeless_Adults"" rel=""nofollow"">https:&#x2F;&#x2F;www.researchgate.net&#x2F;publication&#x2F;315541163_No_Digita...</a>",AI/Data Science
"It&#x27;s interesting the focus this article places on relational databases. The author <i>insists</i> that Salesforce must run on top of Oracle, or Postgres. The notion that any modern company wouldn&#x27;t be using SQL somewhere in their daily process is outlandish.<p>...which is interesting, right? SQL won. There are no competitors. <i>Everybody</i> uses SQL. But if you ask developers how they develop their interfaces, you&#x27;ll get a million answers, ranging from DOS terminals, Electron apps, PWAs, .NET forms, whatever. Maybe what we need is SQL for the view layer to complement the relational backend? SQL is famously easy to pick up because it allows the user to describe what they <i>want</i>, not <i>how</i> to get it. React and friends get us closer to this goal of universal reactive programming, but nothing&#x2F;nobody has capitalized on providing an all-in-one &quot;put words in this box and get what you want&quot; type application. I guess the assumption is that building such a language is functionally impossible, but I really wonder if that&#x27;s true. The app-building app that ultimately wins is going to be the one that lets you build any app, not just an app that serves a particular niche or business process.",AI/Data Science
"I think the big issue is that if you really want autonomous driving over any road, you will likely either need sensors beyond vision or some AGI level model of the world.<p>For example, on the highway, truck infront of you drops some debris.<p>What do you do? It can be dangerous to suddenly swerve or brake, but also dangerous to hit something.<p>What you do In real life is quickly evaluate. You are looking at the object that fell and estimating how deformable it is. For example, if it looks like a wad of paper, you would continue on. Or you estimate if you have clearance based o how big it looks and your mental model of your car’s clearance.<p>You also look at the traffic beside you and behind you to evaluate risk of braking or swerving.<p>You are also doing object recognition. If it is an empty box, you may be ok hitting it, but if it is an infant car seat that fell, you will brake hard&#x2F; swerve even if it is dangerous.<p>Also, for people who bring up the safety of human drivers, one thing to consider is the safety of a hybrid approach where the human is still in charge but you have safety features like lane keeping, blind spot monitoring, automatic emergency braking, etc. That hybrid approach may be actually safer than either only human, or only computer driving.",AI/Data Science
