180,"&gt; Is it really unethical to eat animals when the natural trajectory of most animals lives was likely to be eaten by other animals or die some horrendous death<p>The <i>vast</i> majority of meat that we produce isn&#x27;t sparing animals that would have died anyway, it&#x27;s not from hunting. We bring animals into existence (lots and lots of them, more than would naturally exist) for the sole purpose of killing them. Whether or not that distinction resonates with you morally -- different people have different reactions to that. But for me, it feels tangibly different.<p>I also think about it from an individual perspective instead of a societal perspective. I stopped thinking about a binary &quot;is it ever wrong to eat meat in any situation&quot; question, and the question I started asking instead was &quot;do I need to?&quot; The answer to that question doesn&#x27;t change just because of what the food chain is, or what animals would do to me if they got the chance, or what tigers do in the wild, or whether deer like being eaten by wolves. Those systems might exist, but do I need to be a part of them?<p>Nearly all life on earth exploits other life to live. Humans aren&#x27;t an exception to that, <i>I&#x27;m</i> not an exception to that. But if I can reduce my level of exploitation at little cost to me, then I want to. I don&#x27;t buy that I would be killing animals as an act of charity, I know myself too well. For me personally, I can&#x27;t pretend that I was eating chicken because I cared about the animals.<p>&gt; Isn&#x27;t it better for an animal to live its best life on a free range farm being grass fed, then get quickly and humanely slaughtered?<p>I don&#x27;t think this is a scalable model for food production. My personal experience has been that choosing to eat only ethically sourced meat is more expensive and more difficult than going vegetarian. And I am doubtful even in a perfect world that free range farms with humane slaughterhouses would be capable of providing the amount of meat that people want to eat today. I think in order for that to happen, at the very least a lot of other people would need to go vegetarian or significantly reduce their meat intake.<p>What you&#x27;re asking is a complicated question, and different people have different answers to it, and even saying something like &quot;killing animals is unethical&quot; is itself a really broad answer that means different things to different people. <i>But</i> I feel reasonably confident today saying that inhumane treatment of animals is built into the agriculture industry at a very fundamental level, and I sort of think it&#x27;s naive to say that&#x27;s going to change. I see more people becoming vegetarian at a faster rate than I see people opting to find a local farmer that can supply them with local free range beef. And as uncomfortable as it might be to say, most of the meat you see in a store came from animals that led horrible lives before they were butchered in horrible ways.<p>So on some level, I feel like the underlying ethical question of &quot;do animals exist for food&quot; is kind of besides the point, because even if they do exist for food, I don&#x27;t see any evidence that we can keep meat production going at the same rate and at the same cost without being cruel to animals. I see a lot of people who <i>want</i> to believe that we can do free-range happy cows, but... everything I know about economy of scale contradicts that idea.<p>&gt; If I made a personal decision to stop eating meat, would there be any significant impact at all on the overall environment realistically?<p>Maybe people can debate this, I can&#x27;t say with certainty that insulating your house really well or reducing driving wouldn&#x27;t be comparable in some cases. But most information I have seen suggests to me that for most people, eliminating meat (or even just reducing it) is one of the single highest-impact actions any individual can take for their own lives. So if you are looking for ways to reduce your personal environmental impact, then yes, reducing (or eliminating) meat does help at least as much as anything else you can do.<p>But, let&#x27;s get to the rest of your question:<p>&gt; However, the reality is that me (not) eating a bowl of sashimi once a week makes no difference in the context of, say, countries like Japan slaughtering millions of fish daily<p>Correct, but here&#x27;s the thing. Literally nothing that you do to reduce your own individual emissions is ever going to be significant next to the impact of industry and government. You sort your plastic, great. The impact of doing that is negligible compared to a single bill that regulates how water bottles are made.<p>What makes vegetarianism promising is that there is genuinely a social shift happening on a wider scale than just with individuals, and that social shift has impact on industries. The biggest environmental impact of vegetarianism is when enough people shift that the meat industry overall starts to pivot or produce less meat, or where enough political pressure builds up that meat subsidies start to go away. The other thing that makes vegetarianism promising is that the more demand there is for meat substitutes, the cheaper those products become and the more resources are devoted into developing better products.<p>We saw a similar thing happen with green energy. Individual choices meant very little compared to the amount of energy that industries used. But at some point, green energy got cheap, and demand got higher, and companies started getting into it as well.<p>So I am cautious about telling people that what they do doesn&#x27;t matter, because a lot of this stuff only changes when a certain threshold of people start getting involved or putting pressure on politicians to make changes. I don&#x27;t want to pretend that reducing your own emissions is going to save the world, but I also disagree with the fatalism that says that individual choices don&#x27;t matter.<p>I don&#x27;t know if vegetarianism has enough momentum to significantly reduce meat demand, but it might. And when I look at the alternatives, I don&#x27;t think there&#x27;s any chance at all that the ethical meat movement has enough momentum to change anything, so throwing weight behind the vegetarians is about as good a plan as anything else. Beyond Burgers might get cheaper than normal burgers at some point, and that could drive a large change in how restaurants source food and how normal people buy food. If enough people stop buying fish, commercial fishing might go down because of a loss of profits. But there is basically zero chance that free-range chicken eggs will ever be cheaper than caged eggs, or that fisheries are suddenly going to become sustainable out of the goodness of their own hearts.",science,science,
179,"&gt; The turn away from the humanities is a sign of competitive schooling’s most far-reaching effect: It perverts our culture’s understanding of what education is, and makes us forget that schooling has value beyond status seeking.<p>This seems to be the crux of the article. If only people would study humanities instead of science &amp; engineering. Science &amp; engineering isn&#x27;t a real education.<p>I disagree.<p>I derive great pleasure from the engineering &amp; science education I received in college. I haven&#x27;t the slightest interest in French Literature, etc., and don&#x27;t feel at all deprived for not being educated in it.",science,science,
788,Your comment begs the question: Have you ever personally worked with graduates from any of those schools?,entertainment,entertainment,
786,"Your comment relates it all to bad performance. That doesn&#x27;t cover the &quot;brilliant asshole&quot; problem though, do you think we should allow such behavior for people who show good (personal..) results?",entertainment,entertainment,
785,What&#x27;s to stop the rest of the world from confiscating chinese overseas assets or writing off loans owed to china?,automobile,world,
760,"I am having a similarly bad experience with a Late 2013 MBP after Apple screwed up a battery replacement and the charging port started overheating. I took it to various Apple stores multiple times (they wouldn&#x27;t do the repair by mail). First time, they didn&#x27;t even test the charging system; battery cycle count was the same when I picked it up. Second time, they gave the laptop back to me with the bottom cover screws installed in the wrong places. Third time, they tried to tell me it was a preexisting issue or maybe due to a third-party SSD. The people involved are very friendly but none of them seem to have any idea how a computer works, and they seem to care more about managing my expectations and making me disinfect the LCD with an alcohol wipe than they do about repairing a computer they damaged.",automobile,automobile,
761,I don&#x27;t feel like tipping someone for making an observation or a joke.  This means turning a conversation into an economic transaction.  Is this where the world is going?   Pathetic.,sports,world,
223,Hence the C-a-a for a literal C-a. It&#x27;s not the same but hitting control a a isn&#x27;t much worse than just control a.,sports,technology,
178,&gt; it’s hard to separate the work from some of the things he said<p>Consider watching a television show covering dissociative disorders.,entertainment,entertainment,
222,"what macron announced was just PR speak.<p>ENA will be closed, a new school with a different name (ESP) serving the same function and doing exactly the same as before will be opened in 2022.",world,world,
221,"I believe you&#x27;re looking for something like <a href=""https:&#x2F;&#x2F;github.com&#x2F;taki0112&#x2F;UGATIT"" rel=""nofollow"">https:&#x2F;&#x2F;github.com&#x2F;taki0112&#x2F;UGATIT</a>.",technology,entertainment,
205,"off-topic, but this is a great open-source anime image reverse search engine: <a href=""https:&#x2F;&#x2F;trace.moe&#x2F;"" rel=""nofollow"">https:&#x2F;&#x2F;trace.moe&#x2F;</a>",technology,technology,
768,"FYI, Impossible ground &quot;beef&quot; sauteed for 10m with spices[1] makes for a <i>perfect</i> taco or quesadilla filling. No need for a separate product at all.<p>[1] &lt;1lb beef, 1tsp cumin, 1tsp smoked paprika, 1&#x2F;2tsp garlic powder, 1&#x2F;2tsp chili powder, 1&#x2F;2tsp salt, 1&#x2F;2tsp pepper",sports,sports,
769,"Nobody has spoken of malice. It could have been a simple case of one lab worker getting infected. That would count towards stupidity.<p>Rhetorically speaking, Hanlon&#x27;s razor doesn&#x27;t quite have the same weight as Occam&#x27;s, if only because people tend to view behavior they don&#x27;t understand as stupid. But I&#x27;ll add another &quot;razor&quot;: don&#x27;t attribute to malice what can be attributed to self-interested.",entertainment,science,
770,"This is good, enabling people with Javascript proficiency write complex scripts IMO.<p>There is also <a href=""https:&#x2F;&#x2F;github.com&#x2F;shelljs&#x2F;shelljs"" rel=""nofollow"">https:&#x2F;&#x2F;github.com&#x2F;shelljs&#x2F;shelljs</a> which is implemented on top of nodejs APIs.",technology,world,
771,What is wrong with just using dd?,entertainment,entertainment,
772,"I&#x27;ve been in a position where my abilities vastly out stripped those of the rest of the team. I was insecurely seeking praise and adoration by fixing as many problems with the code as quickly as I could.<p>The mistake, in my opinion, that I made was that I did it alone.<p>I didn&#x27;t communicate with team and work with them at their pace. I blasted ahead and did all the work myself. And it didn&#x27;t win me any friends.<p>They were angry, very angry. They thought I made them look bad and I was being negatively critical of their work. They got defensive and stopped listening to the why and how of my changes.<p>When there&#x27;s a huge skill impedence mismatch between you and the team of your peers you need to consider their feelings. Had I approached the situation by reaching out and explaining my ideas in a way that they understood and guided them along to the solution, I believe I would have had a different outcome. They needed to be part of the solution even if I didn&#x27;t agree with them completely.<p>I needed to accept and believe in myself and not go looking for praise from them. I needed to recognize that they spent their own time and effort on this work. Maybe they were lazy, maybe they didn&#x27;t know better, or maybe they were too busy to write a Performant solution, but the work was partly theirs and I needed to consider that.<p>In the more recent past I have tried to be more guiding and take the team with me to a solution. I&#x27;ve had much better success with this. Sure it&#x27;s slower. Sure I ended up with work that was good but not exactly how I wanted it. But I gained something I hadn&#x27;t expected: a stronger bond with the team, knowing they would listen to meand I to them, and that we all respected each other.<p>I&#x27;m not saying any of this to discredit toxic work environments. I&#x27;ve been on broken teams before where everyone is turned against each.<p>Rhe leadership individuals who matched someone with skills greatly out pacing the rest of the team, placing them as a peer on the team, should have considered tge team dynamics they were creating.<p>I still think it&#x27;s important to recognize your impact on a team and how you work with them. Being &quot;right&quot; about the work is seldom the only factor to consider and does not absolve you of ignoring the thoughts, ideas, and feelings of others.",sports,sports,
773,"Now if someone can get this running through cosmopolitan, my dream will have come true:<p><a href=""https:&#x2F;&#x2F;twitter.com&#x2F;natebirdman&#x2F;status&#x2F;1369469214986174466"" rel=""nofollow"">https:&#x2F;&#x2F;twitter.com&#x2F;natebirdman&#x2F;status&#x2F;1369469214986174466</a>",technology,technology,
774,"Yeah, it&#x27;s pretty good with Pangolin.<p>This is a good summary of the current consensus:<p><i>It is clear from our analysis that viruses closely related to SARS-CoV-2 have been circulating in horseshoe bats for many decades. The unsampled diversity descended from the SARS-CoV-2&#x2F;RaTG13 common ancestor forms a clade of bat sarbecoviruses with generalist properties—with respect to their ability to infect a range of mammalian cells—that facilitated its jump to humans and may do so again. Although the human ACE2-compatible RBD was very likely to have been present in a bat sarbecovirus lineage that ultimately led to SARS-CoV-2, this RBD sequence has hitherto been found in only a few pangolin viruses. Furthermore, the other key feature thought to be instrumental in the ability of SARS-CoV-2 to infect humans—a polybasic cleavage site insertion in the S protein—has not yet been seen in another close bat relative of the SARS-CoV-2 virus.</i><p><a href=""https:&#x2F;&#x2F;www.nature.com&#x2F;articles&#x2F;s41564-020-0771-4"" rel=""nofollow"">https:&#x2F;&#x2F;www.nature.com&#x2F;articles&#x2F;s41564-020-0771-4</a>",science,science,
775,"To tag on, what&#x27;s wrong with plain ol&#x27; cat or cp?",technology,automobile,
776,"I saw a comment in there about how files will get deleted by over zealous av&#x27;s when you plug it into a live system, I didn&#x27;t feel like reading through 60 pages of comments to see if someone solved that issue but I was wondering if you have any suggestions for preventing that.",technology,world,
777,"Not where I am, it&#x27;s mostly just pasture raised cows, there time in a feedlot is very short.",technology,technology,
778,Rise in UFO reports is due to stealthy drone ubiquity.,science,entertainment,
780,"Why &quot;yet&quot;?  Those two ideas don&#x27;t conflict at all.  It&#x27;s not like it&#x27;s a binary choice between the current version of content id or no content detection at all.  It is easily abused, and biased toward claimers.<p>The fact that contentid would go too far in solving his problem wouldn&#x27;t be a reason for <i>him</i> to complain!",technology,technology,
781,"It’s way better than this, to be honest. It’s okay and safe to be more optimistic. These organizations are not perfect but I personally have seen for myself that they do tend to support the best and brightest, and they are actively expanding free offerings rapidly to do this for anyone with internet. It’s becoming more accessible each year to get that quality education in tech and science and business in general, in a condensed quality format.",technology,technology,
782,Or use ventoy and never worry about large files again.,technology,technology,
783,"Wow, this is a <i>much</i> better article than the one from the NYTimes.  Thank you.  Especially for this gem:<p><i>Supplies of raw materials such as nucleotides are also tight.  According to Dr Zarur, Thermo Fisher, an American chemical-supplies company, has spent $200m on a new facility in Lithuania to make these molecules, though the firm itself would not confirm this.</i><p>I would not have expected this, but it definitely explains a whole lot of otherwise-cryptic claims being made in the WTO debate.  I guess it does sort of make sense.  The worldwide demand for pure bulk nucleotides probably shot up hundreds or thousands-fold as a result of COVID-19 vax manufacturing.",sports,world,
784,Nobody is acting with urgency. Acting with urgency would mean a Manhattan Project level of effort where you pump in two percent or so of GDP into decarbonization. Instead we&#x27;re still procrastinating goals to the n+1-th legislative period.,politics,entertainment,
217,"&gt; long after it&#x27;s become obvious that the person in question is simply abusive and taking advantage.<p>Do you consciously notice this change in your own perspective? In real time?<p>I only do this in retrospect. I can look back and see the thing that should have been obvious, but wasn&#x27;t at the time. All the red flags.<p>I have found my ability to detect them has accelerated and my tolerance for them has declined.<p>We are supposed to be tolerant, work hard, do more, stay late, go the extra mile... and, as you said, it&#x27;s taken advantage of.<p>At some point, I realize people are taking advantage of my good nature. And so then I just walk away.<p>But I wish I could not feel bad about it. Guilty somehow.",entertainment,science,
791,"No, sigh, it&#x27;s the other way around. The people who believe the law was broken were lied to, by a corrupt set of regulators. Very apt, given the topic here.<p>The Electoral Commission spent a long time trying to build cases against Leave campaigners. It did so because although theoretically neutral, like a lot of British government institutions it&#x27;s run by people who are openly biased and happy to make strongly political statements on the record. The EC is literally run by people who made public statements saying Brexit was bad and that they wanted Remain to win. Not a good start.<p>So they worked over-time to try and prosecute people who campaigned for Leave, but they themselves (fortunately!) do not have law enforcement powers. This is indeed fortunate because every single case they referred to the CPS and Police was dismissed on the grounds that no crime had actually been committed. The High Court has repeatedly criticised the EC for appearing not to know what electoral laws actually say. Or in other words, the people you are claiming &quot;officially found&quot; one side to have violated the law, had their investigations&#x2F;decisions labelled by the High Court as &quot;unconstructive&quot;, &quot;arbitrary&quot; and lacking &quot;any rational basis&quot; (quoting the judgement itself there).<p><a href=""https:&#x2F;&#x2F;order-order.com&#x2F;2018&#x2F;09&#x2F;14&#x2F;high-court-finds-electoral-commission-unfit-purpose&#x2F;"" rel=""nofollow"">https:&#x2F;&#x2F;order-order.com&#x2F;2018&#x2F;09&#x2F;14&#x2F;high-court-finds-electora...</a><p>Part of the reason the EC&#x27;s arguments were dismissed is that the EC is responsible for issuing interpretations of electoral law. In at least one case, the Vote Leave campaign requested such an interpretation, was told what they were going to do was entirely legal and OK, and then later the EC changed its mind and decided to fine them for following the government&#x27;s official advice. That sort of thing is hard to explain: either the regulators are corrupt, or incompetent, or both, but it&#x27;s certainly not the fault of people who requested clarification about an unclear rule and then were, in effect, lied to about it.<p>The EC&#x27;s quite transparent campaign against anyone who campaigned for Brexit, certainly motivated by the biases of the people appointed to run it, is a classic case of exactly the same problem Americans are complaining about in this very thread w.r.t. net neutrality. The regulator was captured by a certain viewpoint and appeared to care very little about even the appearance of doing their job properly let alone neutrally.",politics,world,
792,"I remember an article from about a decade ago where a virologist was saying that China shouldn&#x27;t be trusted with the highest danger (lvl 4?) labs (IIRC at the time when Westerners were about to or starting to help them build them) because Western labs themselves could barely (or not) be trusted with something as dangerous, and (s)he expected the Chinese to not be able and&#x2F;or not be willing to fully respect the procedures involved.<p>This article suggests that lvl2 protocols were indeed used for lvl4 biohazards.",science,world,
793,"How would I test for damage? I had a Sanho&#x2F;Hyperdrive dock that repeatedly crashed my 2020 MBP. I switched it out for a CalDigit and haven&#x27;t had any problems since then, but I don&#x27;t know how to ensure that nothing was harmed.",science,sports,
794,"It&#x27;s more the way it&#x27;s said. From the guidelines:<p>&gt; <i>Be kind. Don&#x27;t be snarky. Have curious conversation; don&#x27;t cross-examine. Please don&#x27;t fulminate. (...) Please don&#x27;t post shallow dismissals, especially of other people&#x27;s work.</i>",entertainment,automobile,
795,"Yes, all SSD&#x27;s suffer this effect.<p>Just plugging them in often isn&#x27;t enough to make them notice and refresh all data - the SSD doesn&#x27;t have a clock in so doesn&#x27;t know it&#x27;s been unplugged for a long time.<p>The real answer is &quot;for every month an SSD is powered down, leave it powered up for a day&quot;",automobile,automobile,
797,Can you explain what you mean by &quot;the privacy problem&quot;?,technology,automobile,
798,"California dairy is totally a thing though. We had this TV ad campaign decades ago that always ended with &quot;great milk comes from happy cows; happy cows come from California&quot;. Also, Harris Ranch is a pretty decently sized cattle farm down near Coalinga (you know that you&#x27;re getting close to it when you smell the cow poop while driving down I-5).<p>The missing information from these almonds vs cows debate is how big the two respective industries are in California. (I don&#x27;t actually know this answer, so I&#x27;m curious if anyone knows.)",entertainment,world,
801,They kind of actually do. The ranchlands nearby my area haven&#x27;t really changed since they were settled. Windmills and roads are the major change since the 1800&#x27;s.,entertainment,sports,
803,"I assume practically every city in China has wet markets. I wonder how many cities have facilities that do virus research. It might actually be more than you&#x27;d assume; I have no idea what sort of research might happen at universities, You also have to weigh this with SARS Classic originating in China.",science,science,
