524,"&gt;It&#x27;s true that if a black person gives up without trying because they assume they can&#x27;t succeed then their failure contributes to the inequality between the races.<p>Not really my point. But what you&#x27;re saying is legitimate too. Though who are we to judge, considering we don&#x27;t even have unambiguous language to discuss the subject without risking to offend each other&#x27;s sensibilities.<p>&gt;I was most concerned about pushing back on the notion that this subject should be taboo because somehow discussing systemic racism is the real cause of inequality.<p>I&#x27;m not sure if I can resolve the nesting of those clauses. IMHO, taboos are generally counterproductive because avoiding the taboo gives it more power. And enforcing a particular language, tone, or other mode of discourse about race relations can be used to perpetuate thinking that reinforces racism &quot;in the name of fighting racism&quot;.<p>This whole thing is starting to look more and more like we need to find out if we&#x27;re even capable of discussing systemic racism without freaking out, so we can try to conclusively establish what systemic racism is, so that we can look for a solution to systemic racism, so that we can finally stop cops from shooting civilians for being the &quot;wrong&quot; color. This yak shaving is truly the work of a higher intellect...",technology,science,
525,Is there an aquifer? Could be perfect for my dwarven fort.,world,technology,
526,"I only dabble in graphics - but generallly simple edge detection needs really uniform tonality and no textures in the input to work well. Look for example in the more &quot;sketchy&quot; examples how the linework that &quot;looks right&quot; is extracted from a quite noisy input. Also, in the top example where there are houses, the contrast difference that gets extracted to linework is lower than in the character areas.<p>So, the flat shaded images with explicit black outlines - yes, it&#x27;s likely there is much difference with edge detection. But when the image has lots of different contrasts and tonalities this looks much more impressive.",entertainment,world,
527,Netflix also converts electricity to money. It just also requires labor.,technology,technology,
528,"I absolutely respect your choices and your opinion, but I don&#x27;t understand them.  Is the wolf diabolically evil?  No cash involved of course.  Is that the issue?  What if I hunt the animal and kill it and then consume it, like the lion, the tiger, the hawk, and the dolphin?  Is the hunter morally superior to the farmer who raises a steer, providing clean water, well grassed pasture, and then kills in a humane manner for personal consumption?  Is that diabolically evil?  What about the middle man who makes some cash bringing the meat product to someone else who can use it.  Is that where the evilness enters the picture?<p>I am asking the fundamental question.  I will agree completely that large scale food production has some real problems with animal treatment.  I&#x27;m not defending or commenting on that.  I&#x27;m just trying to understand the moral judgements associated with consuming another animal, as is done at just about all levels of the food chain in the natural world.  Our digestive systems, our teeth, our nutritional requirements are all tuned to omnivorous consumption.  Why is it wrong to exercise our natural nutritional choices, plant and animal, that have resulted from millions of years of evolution?",science,sports,
529,That&#x27;s just wrong. Inform yourself on the history of where the saturated fat scare comes from and the disastrous consequences on global health.,world,world,
530,"As soon as you&#x27;ve made a plan for the s pieces, and actually want one, you&#x27;ll get an I piece instead. Screw hatetris, you awful, hateful game!",entertainment,automobile,
531,"It doesn&#x27;t need to though.<p><a href=""https:&#x2F;&#x2F;www.soilassociation.org&#x2F;take-action&#x2F;organic-living&#x2F;what-is-organic&#x2F;"" rel=""nofollow"">https:&#x2F;&#x2F;www.soilassociation.org&#x2F;take-action&#x2F;organic-living&#x2F;w...</a>",world,science,
532,"Good catch! They seems to follow the git-flow model?
<a href=""https:&#x2F;&#x2F;github.com&#x2F;evolus&#x2F;pencil&#x2F;commits&#x2F;development"" rel=""nofollow"">https:&#x2F;&#x2F;github.com&#x2F;evolus&#x2F;pencil&#x2F;commits&#x2F;development</a>
Not that active anyway, but yeah.",technology,automobile,
533,"That’s interesting, because your latter example is pretty excellent. USPS can deliver to anyone in the country (unlike the private companies) and I’d say it’s pretty streamlined. The IRS is definitely in a bad position, but there are two problems: firstly, they’re only enforcing the tax code written by Congress. They can’t just streamline the tax code. Secondly, there are private companies lobbying to prevent the IRS from being as good as it could be. And that will obviously be the same with health care.<p>As a country, we’ve decided it’s in everyone’s best interest to be able to get mail. Private enterprises cannot solve global access problems because they have no incentive to go the extra mile for the last few people the system can’t reach. (Which is why internet is so shitty in rural parts of the country.)<p>So why not health care as well? To me, it seems like the problem are solvable.",technology,science,
534,Did you accidentally a word?<p>&gt;Is buying a in-game COD skin utility? Or how about roblox bucks? How about the trillion dollar derivatives market?<p>No.,technology,automobile,
535,Almost the same in Australia too.,sports,sports,
536,"The bats , horseshoe bats, located in caves approximately a thousand kilometers away have often carried these viruses. [0] And at least 6 times since the year 2000 the collection of these bats have led to humans getting sick.  It just takes some fecal matter dust.<p>So a very likely explanation is some low level employees grabbed some bats, got their suits and vehicles contaminated didn&#x27;t clean things properly, drove down to the Wuhan laboratory, and rested in town spreading contaminated dust or if they were already sick, the virus about.<p>No lab leak needed, just the regular practices when &quot;Wuhan Institute of Virology in China sampled thousands of horseshoe bats in locations across the country&quot;, and those doing so were being sloppy.<p>[0] Bat cave solves mystery of deadly SARS virus — and suggests new outbreak could occur - December 2017
<a href=""https:&#x2F;&#x2F;www.nature.com&#x2F;articles&#x2F;d41586-017-07766-9"" rel=""nofollow"">https:&#x2F;&#x2F;www.nature.com&#x2F;articles&#x2F;d41586-017-07766-9</a>",science,science,
537,"People have always killed other people. Some people even eat other people. And we let them. Have you tried to convince a lion to eat a soy gazelle? I suppose not, because of the strong language barrier. They would probably not digest it very well, as they are real carnivores. My point is, we are capable of having this complex discussion with several points of view and your whole reasoning is &quot;animals eat animals, why shouldnt I?&quot;.",entertainment,world,
538,"tl;dr: Nix will soon be deciding whether to rebuild packages based on the <i>dependency contents</i> rather than the build inputs, which should result in much fewer rebuilds.<p>This is excellent news, and hopefully the savings will end up being used to run more aggressive tests and builds of lower priority packages, to have fewer breakages.",science,world,
540,"There was an article on Slate Star Codex that examined this issue in detail. The conclusion was the opposite - basically that life is worth it even if living in extremely poor conditions - as evidenced by accounts of human survivors of e.g. concentration camps (the majority still wanted to continue living, and even engaged in normal human activities like love and procreation).<p><a href=""https:&#x2F;&#x2F;slatestarcodex.com&#x2F;2019&#x2F;12&#x2F;11&#x2F;acc-is-eating-meat-a-net-harm&#x2F;"" rel=""nofollow"">https:&#x2F;&#x2F;slatestarcodex.com&#x2F;2019&#x2F;12&#x2F;11&#x2F;acc-is-eating-meat-a-n...</a>",science,science,
541,"A little background: The “glowing” remarks refer to Terry Davis’ racist, schizophrenic exclamations about being followed by CIA agents that glow in the dark.<p>Fascinating guy, fascinating OS. If you don’t know Terry at all, the video linked in another comment is a good high-level introduction. For a bit more detail on his technical philosophy this last interview with him can be insightful: <a href=""https:&#x2F;&#x2F;youtu.be&#x2F;HXwNTw4I6Ok"" rel=""nofollow"">https:&#x2F;&#x2F;youtu.be&#x2F;HXwNTw4I6Ok</a><p>This fork throws away some of Terry’ supposedly divinely dictated limitations, so I can only imagine what videos he’d record about it. Still, it’s a fascinating exploration and continuation of his legacy (that he enabled by sharing the code).",technology,world,
542,"I&#x27;ve tried giving away doge on that subreddit, most people believe receive addresses to be too private information to share, I managed to give out 10 out of the 50 I had allocated for the experiment :D",technology,entertainment,
543,This is an interesting theory but I think it is too cynical. Dan Markovits has written on this topic for the last several years.,entertainment,world,
544,Most other non-paywalled websited are better by definition. It&#x27;s blocked-from-reading vs. reading an article.,entertainment,technology,
545,"There is a funny Sci-Fi book by Poul Anderson on this topic:<p><a href=""https:&#x2F;&#x2F;en.wikipedia.org&#x2F;wiki&#x2F;The_High_Crusade"" rel=""nofollow"">https:&#x2F;&#x2F;en.wikipedia.org&#x2F;wiki&#x2F;The_High_Crusade</a>",technology,technology,
546,"I can&#x27;t even test things on Safari. Even the horrible Microsoft offered these huge ass VM images you can run from any operating system to test their IE versions.
In order to show solidarity with the rest of the world besides wealthy US, we tell users to download Firefox and Chrome instead. There are more browsers on that list to show the vast diversity of browsers out there.",technology,technology,
547,&gt; I have over 10 U2F keys.<p>Can you walk me through your workflow with these? Are some stored offsite? Do you have to gather all your keys together when you are signing up for a new service with U2F support?,technology,technology,
548,"&gt; it makes them classist and racist.<p>What do you mean by these terms? I&#x27;d argue that only are if the results, conditional on future college performance, are biased by class or race. Are they? The article you linked doesn&#x27;t say.<p>&gt; The exams were a way to choose among elites. Just like standardized tests today!<p>What percent of students scoring over a 1500 on the SAT are from the top 1% of household earners? I doubt it is not a minority.  There&#x27;s obviously an income correlation, but it&#x27;s far better than simply taking rich kids.<p>How do you propose selecting students?",sports,science,
549,"I had to scroll 1&#x2F;3 down the page before finally finding this argument.<p>Simply said, for cows, eating meat means murder. Not eating meat means extinction.",technology,technology,
550,"&gt; are those that pretend to be benevolent but end up firing you after a vacation.<p>This happened to a close friend of mine relatively recently, both the &quot;benevolent&quot; and the &quot;firing after the vacation part&quot;. I cannot understand such tactics.<p>In the end it was much better for said friend the way things turned out for him, but right when it happened it was a shitty situation to be in, because you just don&#x27;t understand why that is happening to you.",entertainment,world,
552,I only care about one thing  whether that virus came out as the result of aforementioned research. I could not care less about author&#x27;s worldview and whether he eats babies for breakfast.,science,world,
553,"&quot;genre&quot; is one of the few.<p>One of the languages I speak allow for a word-initial &#x2F;ŋ&#x2F;, which English does not have at all.",entertainment,world,
554,"Practicing medicine <i>must</i> be lucrative because it costs an individual student around $240,000 in tuition for the M.D. itself, excluding cost of living.<p>Doctors are made out to be predatory vultures, but unless they come from money they must undergo <i>massive</i> debt burdens that they are not able to even begin paying down the principal on until they&#x27;re well-into their thirties. Imagine  the feeling of taking out half-a-million dollars in student loans to cover both undergrad, and graduate-level training. After that look forward to your 80-hours a week of residency making below hourly minimum wage. [1]<p>Make medical school free, and you&#x27;ll have people lining up the door to practice for low-cost. Make it half-a-million pay-to-play, and you&#x27;ll have people desperately clawing their way out of debt so that some day they can have a family and own a home after a decade of hellish training.<p>Cut the docs some slack. They&#x27;re taking on unimaginable debt burdens for a job that often isn&#x27;t in the same universe of cushiness as something at FAANG (inspecting that anal fissure in the ED at 3am with perks including, well, hospital food), but involves an tremendous service to society.<p>[1] <a href=""https:&#x2F;&#x2F;www.mdlinx.com&#x2F;physiciansense&#x2F;is-it-better-to-be-a-doctor-now-than-it-was-50-years-ago&#x2F;"" rel=""nofollow"">https:&#x2F;&#x2F;www.mdlinx.com&#x2F;physiciansense&#x2F;is-it-better-to-be-a-d...</a>",technology,science,
555,"The bats , horseshoe bats, located in caves approximately a thousand kilometers away have often carried these viruses. [0] And at least 6 times since the year 2000 the collection of these bats have led to humans getting sick.  It just takes some fecal matter dust.<p>So a very likely explanation is some low level employees grabbed some bats, got their suits and vehicles contaminated didn&#x27;t clean things properly, drove down to the Wuhan laboratory, and rested in town spreading contaminated dust or if they were already sick, the virus about.<p>No lab leak needed, just the regular practices when &quot;Wuhan Institute of Virology in China sampled thousands of horseshoe bats in locations across the country&quot;, and those doing so were being sloppy, as they have been known to be repeatably.<p>[0] Bat cave solves mystery of deadly SARS virus — and suggests new outbreak could occur - December 2017
<a href=""https:&#x2F;&#x2F;www.nature.com&#x2F;articles&#x2F;d41586-017-07766-9"" rel=""nofollow"">https:&#x2F;&#x2F;www.nature.com&#x2F;articles&#x2F;d41586-017-07766-9</a>",science,science,
558,"&gt; it makes them classist and racist.<p>What do you mean by these terms? I&#x27;d argue that they only are if the results, conditional on future college performance, are biased by class or race. Are they? The article you linked doesn&#x27;t say.<p>&gt; The exams were a way to choose among elites. Just like standardized tests today!<p>What percent of students scoring over a 1500 on the SAT are from the top 1% of household earners? I doubt it is not a minority.  There&#x27;s obviously an income correlation, but it&#x27;s far better than simply taking rich kids.<p>How do you propose selecting students?",sports,science,
559,"&quot;genre&quot; is one of the few.<p>One of the languages I know allows for a word-initial &#x2F;ŋ&#x2F;, which English does not have at all.",entertainment,world,
560,"there have been so many headlines on this subject over the past year, i&#x27;ve been trying to save as many articles (in english) i could find that reference the topic in some way: <a href=""https:&#x2F;&#x2F;news.coffee&#x2F;wuhan_lab_snippets"" rel=""nofollow"">https:&#x2F;&#x2F;news.coffee&#x2F;wuhan_lab_snippets</a>",technology,world,
561,"You have to understand the Apple fanboy mindset. If it breaks, it&#x27;s your fault. Soldered SSD? Do backups you dummy! Over heating? Just use it for email and browsing. Dead pixels? Get better glasses. No ESC key? Buy an external keyboard. Keys not working? Don&#x27;t push them so hard, they&#x27;re butterflies!",technology,technology,
562,"&quot;Reset this PC&quot; is one possibility that you&#x27;re thinking of. Has options for saving or deleting all user-dir files, (afaik) always removes installed applications. Can also fully format the disk, and pull a clean copy of the installer from the &#x27;net.",technology,world,
302,Etcher is easy to use but why on earth did they decide to make it an electron app?,technology,technology,
301,"This guy Vasallo sounds like an entitled, self-righteous prick.  YT offered him a fix but he didn’t want it.",technology,sports,
300,It is an idea based on you have some method of determining the best employees and you select the most productive which sounds fair.<p>What happens is people make choices that put them in that 10%.  Some by increasing odds by hiring awful in purpose.  Some will target others work.  Selecting the right group becomes more important than doing good work.<p>I believe you should hire or fire based in objective numbers.  If 50% are bad fire them now.  If none are bad keep them and give them a raise.,entertainment,technology,
299,"I think danShumway answered 1) pretty well. I just wanted to add my opinion about 2).<p>Nothing an individual does in terms of personal behavior can have any &quot;significant impact&quot; at a global scale. If all humans made decisions like this, we would all come to the same conclusion, none of our individual actions are responsible. Which, while true, is ultimately a useless conclusion. I&#x27;d rather that we as a collective change our fundamental behavior for the better instead of governments imposing on our lives. If all governments decided tomorrow to ban all meat products, the world would undoubtedly be in a much better place. You also mention second order effects (small circle of influence) but even that is marginal. Being a vegan, I believe I&#x27;ve &quot;converted&quot; (just by exposing them to an alternative lifestyle) two people to vegetarian.",technology,world,
298,Really? How is this activated or enabled?,technology,entertainment,
297,"For people that aren’t good socially (especially those that don’t fit it in the culture quickly) having a group of people that you try to work with is sorta useless advice.<p>Speaking anecdotally: It took me a long time to understand how to be a good listener and pick on social cues and not be constantly worried about appearing like an idiot. While I was cordial with coworkers I tried not to engage with them after work: I’ve always wanted to keep those 2 worlds separated. I do hang out with coworkers when eg it’s crunch time, or in celebrating a successful launch. But that’s it.",entertainment,entertainment,
296,"So, the technical interviewer says “no hire.” But the VP (who went to the candidate’s alma mater) says yes. And the Director who knows the candidate’s uncle from the country club says yes. And the candidate really laid it on thick for the hiring manager who has the final say. What did the tech nerd say, again?<p>It increasingly feels like the world’s reward systems have been captured by and saturated  with these charming phonies who only know how to game the system. Put all your skill points into charisma and people will just hand you money and opportunities. I’ve spent my whole career perpetually a couple of rungs down the totem pole from these well-pedigreed charmers, and hear them talk their smooth, but ultimately empty talk over and over.<p>Whether it’s college applications or job applications, the longer I go at it, the more convinced I am that the ability to “seem like the right kind of successful sort of person” gives you the best results. Better than track record, better than demonstrable skills, better than potential and willingness to do hard work.",sports,world,
295,"But I suspect you&#x27;ve convinced yourself with explanations that the sensors of the Navy around those released UAP videos were somehow invalid, or the many, if you search, nightvision UFO video, are also invalid. it would be cool if humans really had silent anti-gravity triangles, and if people see those or have an experience with them I think it&#x27;s wrong to say well given that one of the possibly interpretations is aliens therefore this evidence must be discounted in these people must be crazy. I&#x27;m not saying you&#x27;re saying that but I think there&#x27;s definitely an incorrect trend in that direction<p>Something interesting about this stuff is that there&#x27;s not perfect cover across all sensors always. Maybe sometimes you have people seeing something that&#x27;s not on radar. Or you have something that&#x27;s on radar but not on other types of sensor. Or you have something that&#x27;s in the infrared but not in the visible. I&#x27;m not asking you to believe anyone interpretation just to be open and consistent I think that if you&#x27;re willing to believe the sensors are malfunctioning and creating ghost tracks it&#x27;s also reasonable to consider that the sensors are not capable of picking up some sorts of technology. I understand that depending on your pliers there&#x27;s different takes have different probabilities to you but I don&#x27;t think it&#x27;s okay to rush to certainty and discount any of those interpretations and say that anyone who suggests as much or obvious for those is out and out crazy. that&#x27;s offensive and abusive to people and not I think in the spirit of investigation and curiosity.",entertainment,world,
564,"My father told me, when I was 10, that I might have never been born if my grand parents got caught during WW2.<p>I take social darwinism and competition very personally and seriously. I have the most difficulty accepting social hierarchy because they remind me of people being better than others for arbitrary reasons.<p>I often rationalize that what happened in germany, also happens to a certain degree between human beings in normal times, and it disgusts me. I feel like eugenics won many battles, just not the war, and that if Nazism happened, it tells a lot about the human nature of people around us.",entertainment,entertainment,
294,"How WSJ stipple drawings are made: <a href=""https:&#x2F;&#x2F;youtu.be&#x2F;sZzP9PQJXLs"" rel=""nofollow"">https:&#x2F;&#x2F;youtu.be&#x2F;sZzP9PQJXLs</a>",technology,technology,
293,"Been there, my friend. Been there.",entertainment,entertainment,
1029,"What exactly is Timescale DB, is it built on top of Postgres or a plugin for postgres or postgres API compatible DB built from ground up?",politics,technology,
292,"As a canadian, are we really that much more equal than the USA? Sure, maybe we have less of the extremes on both sides (Less billionairs, and i suspect less hopelessly poor, although i don&#x27;t know the number on that), but we still have rich people and poor people, a good uni still gives you a major step up.",world,world,
290,Wouldn&#x27;t it logically follow that issues of systemic racism are a bigger problem than the narrative of systemic racism? Can&#x27;t that be true without being a brainwashed white guilted liberal?,technology,science,
1032,"Rufus is nice and all, but these days I want a dozen different OS installs and live cds on not-a-dozen thumb drives.  YUMI is my one-stop shop.",technology,politics,
289,"I&#x27;d pronounce those the same (western US accent), but it can vary.  Check out the caught&#x2F;cot merger, for example: <a href=""https:&#x2F;&#x2F;en.wikipedia.org&#x2F;wiki&#x2F;Cot%E2%80%93caught_merger"" rel=""nofollow"">https:&#x2F;&#x2F;en.wikipedia.org&#x2F;wiki&#x2F;Cot%E2%80%93caught_merger</a>",technology,technology,
288,It&#x27;s true that if a black person gives up without trying because they assume they can&#x27;t succeed then their failure contributes to the inequality between the races. I&#x27;m sure I could have put it better. I was most concerned about pushing back on the notion that this subject should be taboo because somehow discussing systemic racism is the real cause of inequality.,automobile,science,
227,<p><pre><code>   ip route change ROUTE quickack 1 dev STRING</code></pre>,technology,automobile,
287,"<a href=""https:&#x2F;&#x2F;archive.is&#x2F;vZMkb"" rel=""nofollow"">https:&#x2F;&#x2F;archive.is&#x2F;vZMkb</a>",technology,technology,
286,I guess inkjet printers are good for something after all!<p>Was there any reason...why he did that?,entertainment,entertainment,
1033,"&gt; If we apply Occam&#x27;s razor [1] decision between &quot;Wuhan, however, is home of the Wuhan Institute of Virology, a leading world center for research on coronaviruses&quot; and &quot;Wuhan, there is a wet market where under certain conditions virus can jump from bat to monkey to person&quot; is relatively straightforward<p>Heh, what is the Razor or other applicable language construct when someone gives two options and then suggests there&#x27;s one they think is obviously correct, without saying which one or why - leaving it completely opaque or confusing to the casual reader?<p>I legit do not know which of the two cases here you think Occam&#x27;s Razor applies straightforwardly. I can make easy cases for both sides being the simplest explanation.<p>e.g., &quot;it seems simplest that the leading world centre would have excellent safety protocols and thus the chaotic wet market in a region known for those viruses is more likely the source&quot;, vs &quot;it seems simplest that human error in a research environment studying these viruses compared to a wet market where, if that was a likely vector, we&#x27;d surely be seeing these things way more often&quot;, kind of thing.",world,science,
