76,"Train hundreds of models on the cloud from your laptop.<p>As a thanks to the community, use Grid for FREE today on our community plan!<p>Try it here: https:&#x2F;&#x2F;www.grid.ai&#x2F;pricing&#x2F;<p>Grid in 3 minutes: https:&#x2F;&#x2F;www.youtube.com&#x2F;watch?v=Wm1jjaQzPf0",technology,science,AI/Data Science
114,"Um, we could stop doing gain-of-function research for one.  This would be a pretty important datapoint on that risk analysis.",science,science,AI/Data Science
77,"I just want to share a really funny story with the community, which cost Facebook 200k of lost advertising revenue because of stupid &quot;security&quot; filters with no way of contacting support.<p>Long story short, I created a new ads account for my current organization. 2 factor auth is enabled on my account, everything should be fine, but FB considers it a suspicious activity.<p>So the account is locked with NO WAY to unlock it: no option for text msg or even ID verification which FB is notorious for.<p>&quot;Denys, Your Account Has Been Locked
We saw unusual activity on your account. This may mean that someone has used your account without your knowledge.<p>To protect you, your profile is not visible to people on Facebook and you can&#x27;t use your account.&quot;<p>The Learn More page leads to this helpful article: https:&#x2F;&#x2F;www.facebook.com&#x2F;help&#x2F;203305893040179<p>And then there is a vicious cycle of redirecting back to the initial page.<p>There are a few forms which is possible to find on REDDIT (not official facebook support), but they don&#x27;t seem to be helpful as you never receive any kind of response.<p>I&#x27;m glad that I had my ad campaigns stopped on this account, otherwise it would have been a nightmare to deal with chargebacks for something I have no control over.<p>TLDR: If you rely on automated system to block users, make sure you provide them with options to contact a real person in case AI goes crazy.",technology,entertainment,AI/Data Science
90,"I see a general trend in academia to include machine learning in every proposal and apply it to every problem. I failed yet to see the advantages outside prediction which is some cases are indeed very useful e.g. the protein folding but I don&#x27;t see how far it can advance science. My question is, do you think ML in academia is currently over-hyped?",science,world,AI/Data Science
234,"Related: <a href=""https:&#x2F;&#x2F;www.datadoghq.com&#x2F;product&#x2F;"" rel=""nofollow"">https:&#x2F;&#x2F;www.datadoghq.com&#x2F;product&#x2F;</a><p>&gt;&quot;See across systems, apps, and services<p>With turn-key integrations, Datadog seamlessly aggregates metrics and events across the full devops stack.<p>SaaS and Cloud providers<p>Automation tools<p>Monitoring and instrumentation<p>Source control and bug tracking<p>Databases and common server components<p>All listed integrations are supported by Datadog<p>Get full visibility into modern applications<p>Monitor, troubleshoot, and optimize application performance.<p>Trace requests from end to end across distributed systems<p>Track app performance with auto-generated service overviews<p>Graph and alert on error rates or latency percentiles (p95, p99, etc.)<p>Instrument your code using open source tracing libraries&quot;<p>etc.",technology,automobile,AI/Data Science
73,I subscribe to MIT technology review and am looking for something similar but with more focus on data. Any recommendations?,technology,technology,AI/Data Science
72,"Working on a new project!
Using GPT-3 to automatically write your sales emails.
Personalized to your prospect’s business.<p>Sign up for beta:
https:&#x2F;&#x2F;forms.gle&#x2F;gXyTHWsUfMWdNuzN7",technology,automobile,AI/Data Science
51,I am a middle schooler and I created this library to make it extremely easy to quickly experiment with different machine learning models for various tasks.<p>GitHub link: https:&#x2F;&#x2F;github.com&#x2F;geekjr&#x2F;quickai<p>Please let me know if you have any questions&#x2F;feedback.,technology,entertainment,AI/Data Science
365,"Is there a [Linked Data] resource with the information in this interactive IPA chart (which is from Wikipedia FWICS) in addition to?:<p>- phoneme, ns:&quot;US English letter combinations&quot;, []<p>- phoneme,  ns:&quot;schema.org&#x2F;CreativeWorks which feature said phoneme&quot;, []<p>AFAIU, WordNet RDF doesn&#x27;t have links to any IPA RDFS&#x2F;OWL vocabulary&#x2F;ontology yet.",technology,technology,AI/Data Science
375,"As a FB marketing expert, this wouldn&#x27;t work. Yes we could target you, but the market is too small and not worth the effort. The minimum audience worth targeting",entertainment,world,AI/Data Science
374,"&gt;I&#x27;ve seen a grown man, extremely well educated, data scientist make a fellow data scientist cry. I&#x27;ve. Seen. Things.<p>Data scientists seem to be on a level of their own when it comes to disrespecting colleagues. I&#x27;ve been surprised by this recently.",science,science,AI/Data Science
580,"<i>Data scientists seem to be on a level of their own when it comes to disrespecting colleagues. I&#x27;ve been surprised by this recently.</i><p>Pretty much every developer, when brought in as a replacement, will bad-mouth their predecessor, say their code is junk and needs to be totally rewritten, etc. Data scientists just take it to the next level, that&#x27;s all.",science,science,AI/Data Science
200,"PSA: As user &quot;mromanuk&quot; points out below (and links to relevant articles), the author of this article &quot;Nicholas Wade&quot; is a racist. So exercise caution while reading this article. Don&#x27;t accept his narrative but do your own research from any &quot;actual scientific data&quot; leads in the article.",sports,sports,AI/Data Science
149,Lately all my usb thumb drives have been overheating when using any tool so last time I ended up using an external hard drive after burning through a number of thumb drives.<p>Anyone has an idea how to artificially limit write speed besides running it over a USB 1 hub?,sports,world,AI/Data Science
156,Photoshop just detects edges and does thus ends up detecting both sides of a drawn line or change in shading for example. This does not appear to show such artefacts.,science,world,AI/Data Science
570,"&gt;&quot;Omega Intelligence: This is the most advanced form of intelligence imaginable.
It operates in an infinite and timeless environment. Since there is no time in its environment, it doesn’t even make sense to talk about processing speed as each operation is atemporal. This agent does not have memory limits as the space it can access is infinite. Its intelligence includes all the others within it, in the same way that the infinite power set of complex numbers contains within it all the combinations of minor power sets.
There is no limit to the computational problems it can solve, it is however subject to the limits of formal systems, in the sense that it cannot solve, for example, Turing’s halting problem.<p>[PDS: If it were to exist, then -- <i>I wouldn&#x27;t be so sure about that!</i>  That&#x27;s because if it existed, it would, of necessity, include the ability to <i>solve and resolve what humans, especially human philosophers (with the possible exception of Zen Masters) call Paradoxes...</i> You know, like The Irresistable Force Vs. The Immovable Object -- which wins?  Etc., etc., etc...]<p>It is instantly aware of any state of consciousness that may exist, its existence is a continuum of qualia, an eternal kaleidoscopic ocean of experiences.
In fact this being is so omnipotent that it does not even make sense to consider it as an intelligent agent.
It is the absolute, it is what comes closest to the god of monotheistic religions.
It is the concept that includes all the others, It is the space of propositions itself.&quot;<p>PDS: You know, I wonder if such an Intelligence, if it were to exist -- would be able to <i>delete itself</i>.<p>In other words -- if we think about it as a virtual machine, which contains computational resources, and this virtual machine in turn contains other virtual machines (and their computational resources) -- and these contained sub-virtual machines go on for infinity (since it has infinite computing power) -- then <i>would it be possible for it, like a Zen Master -- to become empty of all of the virtual machines it contains, and all of the virtual machines contained by those virtual machines?</i><p>You know, like &quot;turtles on top of turtles&quot; -- stacked infinitely high...<p>Well, imagine that the last turtle in the stack -- tells the one above it to &quot;delete itself&quot; -- but before doing that, it has to pass the request on to the one above that!<p>It&#x27;s sort of like, what happens (if the first infinite virtual machine containing all of the others) is root -- but you&#x27;re in some other contained virtual machine -- can you ask root to delete it&#x27;s root -- and then delete itself?<p>When you ask it to delete its root -- that request gets passed up to the next higher virtual machine -- who in turn queues deleting all of itself -- and passes the request up to the next higher virtual machine...<p>...All the way up to Infinity...<p>Although -- I&#x27;d argue that a Zen Master, trained in meditation, trained in &quot;emptying the mind&quot; -- deletes what is contained therein MUCH FASTER than an &quot;Omega Intelligence&quot; could!<p>(&quot;It&#x27;s really smart -- it just can&#x27;t delete itself!&quot; &lt;g&gt;)<p>Stupid Realization: Perhaps a Zen Master who can empty his mind instantaneously -- perhaps his &quot;Intelligence&quot; is &quot;Omega Intelligence&quot;...<p>Then of course, there&#x27;s the eternal question of &quot;What is the sound of one Omega Intelligence clapping?&quot;. &lt;g&gt;<p>Well... we don&#x27;t know the answer to that... &lt;g&gt;<p>But perhaps the Omega Intelligence itself (prior to deleting itself!) -- does... &lt;g&gt;",technology,science,AI/Data Science
515,"&quot;In this nearly 4-hour SPECIAL EPISODE, Rob Reid delivers a 100-minute monologue (broken up into 4 segments, and interleaved with discussions with Sam) about the looming danger of a man-made pandemic, caused by an artificially-modified pathogen. The risk of this occurring is far higher and nearer-term than almost anyone realizes.<p>Rob explains the science and motivations that could produce such a catastrophe and explores the steps that society must start taking today to prevent it. These measures are concrete, affordable, and scientifically fascinating—and almost all of them are applicable to future, natural pandemics as well. So if we take most of them, the odds of a future Covid-like outbreak would plummet—a priceless collateral benefit. &quot;",entertainment,world,AI/Data Science
702,"The graphics are cute, but the article left me with way more questions than answers.  It spent most of its time trying to impress the reader with how much interstate shipping was involved in the process (who cares?).<p>No details on which ingredients are the ones causing so much consternation at the WTO right now, nor any answer to the obvious question &quot;why aren&#x27;t the DNA plasmids made the same way other commercial plasmid services make them&quot;?<p>But hey, it&#x27;s the NYTimes.  They have to hold the attention of an audience that mostly has no science background.",technology,world,AI/Data Science
139,"&gt;&quot;Forth is a text-based language that is essentially context-free. It combines &#x27;words&#x27; separated by spaces, to construct new words. About 150 such words constitute a system...<p>[...]<p><i>Such a system has 3-8K bytes of code compiled from 10-20 pages of source. It can easily be implemented by a single programmer on a small computer.</i><p>[...]<p>Another application of least-squares was the program CURVE, coded in Algol (1964). It is a general-purpose non-linear differential-corrections data-fitting program. Its statistical rigor provides insight into agreement between model and data.<p>The data format and model equations were interpreted and a push-down stack used to facilitate evaluation.<p><i>CURVE was an impressive precursor to Forth.</i>&quot;",technology,technology,AI/Data Science
225,"The training is what requires a good GPU.  For inference, a CPU should be fine.",sports,sports,AI/Data Science
137,These findings should also apply to phone manufacturers -- mandate providing a more realistic number of years of security updates.  Closer to 7y but definitely more than 3y.,technology,automobile,devops/networking
266,"For SARS (2003) It took 3 years to find the intermediate host (civets). And 14 years (2017) to find the bat parent of the virus[1].<p>[1]<a href=""https:&#x2F;&#x2F;en.wikipedia.org&#x2F;wiki&#x2F;Severe_acute_respiratory_syndrome#Origin_and_animal_vectors"" rel=""nofollow"">https:&#x2F;&#x2F;en.wikipedia.org&#x2F;wiki&#x2F;Severe_acute_respiratory_syndr...</a><p>Guess who found the bat host? Shi Zhengli of the very WIV in question.",technology,science,devops/networking
896,"All these comments explaining that you can&#x27;t have an SSD that&#x27;s not permanently locked to the secure enclave on the Logic Board™ because of &quot;security&quot;.<p>Which means that a customer <i>really needs</i> a backup... Which by definition can&#x27;t be locked to the motherboard. SMH.<p>Apple™ apologists come up with any justification, no matter how implausible, for Apple™&#x27;s user-hostile self-serving design choices.<p>I guess it&#x27;s just a happy coincidence that then they can charge customers for using their Cloud as a backup, because they&#x27;ve removed any autonomy that the customer might have had otherwise.<p>One button saying, &quot;set your own recovery password&quot;, and one 20c connector, and then any customer or lowly genius bar™ Logic Board™ replacement drone could easily transplant the drive into another PC when the self destructing crap Apple™-designed Logic board™ with tiny inadequate heatsink or secure enclave™ linked touchbar or dust-powered exploding keyboard switch or whatever other obvious self destruct mechanism they&#x27;ve designed in inevitably kicks the bucket.<p>The cherry on the shit sundae is that they would still get to sell another mac to the lucky 𝚟̶𝚒̶𝚌̶𝚝̶𝚒̶𝚖̶ customer, so there is no advantage to them in preventing this.<p>Apple™ just doing asshole things because Apple™.<p>It&#x27;s like the story of the scorpion and the frog [1]. &quot;I couldn&#x27;t help it. It&#x27;s in my nature.&quot;<p>[1] <a href=""https:&#x2F;&#x2F;en.wikipedia.org&#x2F;wiki&#x2F;The_Scorpion_and_the_Frog#Synopsis"" rel=""nofollow"">https:&#x2F;&#x2F;en.wikipedia.org&#x2F;wiki&#x2F;The_Scorpion_and_the_Frog#Syno...</a>",technology,technology,devops/networking
716,This looks fun. I wonder what kind of applications could benefit from a UI paradigm like this (virtual movable windows inside a browser tab). The only ones I have seen in the wild are demos (the one with winamp and the prank winXP one) and some limited compose&#x2F;chat windows in Gmail and Linkedin.<p>This could work for things like Email clients or UI&#x27;s like Owncloud&#x2F;Nextcloud. Any app that wants to allow the user to juggle multiple actions at once.,technology,technology,devops/networking
613,"For what it&#x27;s worth, google&#x27;s MFA setup is the best of any I&#x27;ve used. You can (and should) setup a variety of second factors on your google account so that if one of them fails for some reason you&#x27;ve got other options. Between backup codes, TOTP, pixel phone verification and multiple FIDO keys there&#x27;s plenty of options.<p>This compares very favourably to, say, AWS where you can only have a single second factor and the recommended(!) way of protecting against loss of a second factor is to have multiple accounts with different second factors registered to each of them.",technology,automobile,devops/networking
39,"Recently, I&#x27;ve been receiving a lot of communications in Chinese. Some examples:<p>* Electronic service agreement updates from Microsoft Azure via email (MS account default language English)<p>* Web ads from PG&amp;E<p>* Certain websites render in Chinese<p>* Some Facebook ads render in Chinese<p>* Spam junk snail mail from State Farm<p>For context, I moved to China at the beginning of 2020 before returning to the US toward the end of last year, accessing the Western web through VPN in the meantime. I don&#x27;t have an ethnic Chinese name. I&#x27;ve always had English set as my default language for my Google and Facebook accounts. All my devices are configured to use English as the default language. My web browser does request &quot;Accept-Language: en-US,en;q=0.9,zh-CN;q=0.8,zh;q=0.7&quot;, which could maybe explain some of it, though it&#x27;s obnoxious that the en-US would be overridden. I&#x27;ve never updated any address with any service with my Chinese one, though I guess I did use that one to sign up for Alibaba Cloud.<p>So, what&#x27;s a good theory? I don&#x27;t mind seeing stuff in Chinese, per se; it&#x27;s just surprising, particularly the the snail mail from State Farm, though I guess in principle it&#x27;s no weirder than the email. My running theory is that I&#x27;ve been tagged in some obscure but widely used database as having Mandarin as my preferred language. Does this seem like a plausible reason? If so, any idea which one it is and which company owns it? My first guesses would be Google or Facebook, but by all appearances they both know I prefer English.",technology,technology,devops/networking
220,"Security for similar offerings in AWS and Azure is quite good, I guess that wasn&#x27;t the reason, after all Google only hires creme de la crème.",technology,technology,devops/networking
48,I&#x27;m working on a post about supply chain attacks in development and I&#x27;m looking for examples of data&#x2F;files&#x2F;services you have on developer machines which should be protected from rogue packages&#x2F;software. Bonus points for things related to development activities - those that should not be accessible by (for example) a package being installed but are required in other dev-related actions.<p>For example:<p>- SSH keys - both for personal use and repo updates<p>- package repo credentials - npm&#x2F;pypi&#x2F;...<p>- browser cookies for service logins<p>- cryptocurrency wallets<p>- confidential documents (scanned &#x2F; signed documents)<p>What other types are you worried about they I may not be aware of?,technology,technology,devops/networking
26,"The AWS Cloud&#x2F;Devops Engineer will be working with the engineering team and focusing on AWS infrastructure and automation. A key part of the role is championing and leading infrastructure as code. The Engineer will work closely with the VP of Operations and Security to build, manage and automate our AWS infrastructure.<p>Duties &amp; Responsibilities:<p>- Design cloud infrastructure that is secure, scalable, and highly available on AWS
- Work collaboratively with software engineering to define infrastructure and deployment requirements
- Provision, configure, and maintain AWS cloud infrastructure defined as code
- Ensure configuration and compliance with configuration management tools
- Administer and troubleshoot Linux based systems
- Troubleshoot problems across a wide array of services and functional areas
- Build and maintain operational tools for deployment, monitoring, and analysis of AWS infrastructure and systems
- Perform infrastructure cost analysis and optimization<p>Qualifications:<p>- At least 3-5 years of experience building and maintaining AWS infrastructure (VPC, EC2, Security Groups, IAM, EC2, Auto-scaling, CloudFront, S3)
- Strong understanding of how to secure AWS environments and meet compliance requirements
- Expertise using Ansible and&#x2F;or AWS SSM for configuration management
- Hands-on experience deploying and managing infrastructure with Terraform
- Solid foundation of networking and Linux administration
- Experience with FreeBSD, FreeBSD Jails, Gerrit, CI&#x2F;CD pipelines, Jenkins, ELK&#x2F;Consolidated logging and deploying self healing applications on AWS
- Ability to learn&#x2F;use a wide variety of open source technologies and tools
- Strong bias for action and ownership<p>Bonus<p>- Previous exposure to healthcare domain and security needs
- Previous startup experience would be a huge plus
- Latent desire and&#x2F;or curiosity in related domain like software development, front-end engineering, security or project management<p>Apply here: <a href=""https:&#x2F;&#x2F;angel.co&#x2F;l&#x2F;2v33G9"" rel=""nofollow"">https:&#x2F;&#x2F;angel.co&#x2F;l&#x2F;2v33G9</a>",technology,technology,devops/networking
913,&gt; but U2F is a real pain because you can&#x27;t make backup copies of the key.<p>The backup is to have multiple U2F keys. I have over 10 U2F keys. Most (but not all) providers allow you to register multiple U2F keys.<p>Amazon AWS for some foolish reason (in my opinion) is one of those outliers which only allows one U2F keys to be registered. I&#x27;ve read people&#x27;s reasoning on why that is and none of it makes sense to me.,technology,technology,devops/networking
590,"What are you basing your statement on? It is bigger than AWS at least in 2019<p>&quot;&quot;Sep. 13, 2019 Updated: Sep. 13, 2019 10:29 p.m. Oracle OpenWorld, a tech conference with some 60,000 attendees&quot; <a href=""https:&#x2F;&#x2F;www.sfchronicle.com&#x2F;bayarea&#x2F;article&#x2F;San-Francisco-warns-of-Oracle-OpenWorld-14439065.php"" rel=""nofollow"">https:&#x2F;&#x2F;www.sfchronicle.com&#x2F;bayarea&#x2F;article&#x2F;San-Francisco-wa...</a><p>&quot;...From December 2 to December 6, we expect more than 60,000 attendees will spread out across six venues on the Las Vegas Strip, promising to make re:Invent 2019 the biggest re:Invent yet...&quot; AWS re:Invent 2019<p>&quot;...Well, here we are: a little over a week after Salesforce’s 17th Dreamforce. As a lush green forest burgeoned in downtown San Francisco, over 171,000 people from 120+ countries around the globe came together to have the time of their lives with fellow Trailblazers, learn how to help their customers succeed, and promote equality, sustainability, and trust — in short, to transform their businesses and the world we share...&quot; <a href=""https:&#x2F;&#x2F;www.salesforce.com&#x2F;blog&#x2F;dreamforce-2019-infographic&#x2F;"" rel=""nofollow"">https:&#x2F;&#x2F;www.salesforce.com&#x2F;blog&#x2F;dreamforce-2019-infographic&#x2F;</a>",technology,technology,devops/networking
40,"I’m a dev so my networking is a bit rusty, but I’m curious if anyone has found the solution to effective parental controls?<p>We’re having trouble with our son sneaking the internet and we’ve become concerned about what he’s doing. We’re not looking for a snooping tool as we will be having regular communication with him as to what we’re doing and what our expectations are, but he’s definitely having trouble controlling his urges and we want a little physical help to go along with the counselling and communication.<p>Up until now we’ve used iOS screen time but it’s become too easy for him to get around so I’m thinking about something at the router level. Is there a decent solution here? Googling and online reviews haven’t given me much hope.",technology,politics,devops/networking
11,"I run a B2B SaaS startup and we’ve consistently had problems receiving payments on time or customers honouring their contract length.
Some customers pay months after the invoice due date, others sign a contract but never start paying, others, who might be small startups themselves, might stop paying when they decide to (i.e. because they decided to change priorities or just run into financial difficulties). Due to the custom nature of our pricing, it’s hard to set up an automated process.<p>We’re exploring an idea to help us and others that are in a similar situation by allowing you to check the payment behaviour of small businesses&#x2F;prospects before signing a contract, in cases where running a credit check might not make sense. Think of it as being able to read reviews for your prospective customers.<p>Do you currently have this problem and would you use such a service&#x2F;find it useful?
Would you pay for it? 
Why or why not?",technology,automobile,devops/networking
